id,subreddit,score,title,timeCreated,numComments,subscribers
5okc9t,gifs,63437,3rd Grade Teacher Has A Different Secret Handshake With Every Student,1484712155.0,2068,15857238
6albv3,gifs,63394,Get yo weak shit out of here boys ,1494549955.0,1542,15857238
6cd49v,gifs,63384,Teacher in a pink tutu schools a student,1495347649.0,1171,15857238
6ill35,gifs,63376,Bald Eagle incoming,1498077954.0,1928,15857238
7qjfuq,gifs,63335,Choo Choo ,1516048928.0,1126,15857238
74jbx3,gifs,63289,Here comes the wave ,1507269785.0,1354,15857238
6gouef,gifs,63285,Bruce Lee s only real fight recorded on tape,1497255333.0,3530,15857238
61fbyr,gifs,63256,The Dzhanibekov Effect,1490474349.0,1531,15857238
6minpw,gifs,63252,Nba 2k lag in real life,1499761497.0,757,15857238
81hiq3,gifs,63034,Raccoon being forced to socialize,1520049873.0,974,15857238
472wut,gifs,63015,Great demonstration of why the kneecap is a useful thing ,1456203149.0,1725,15857238
7wzctk,gifs,63000,Fireman readiness,1518452265.0,1149,15857238
7dexfh,gifs,62995,Extreme dadding,1510890371.0,778,15857238
7sm5ez,gifs,62954,Horsing Around,1516817740.0,1096,15857238
78bx81,gifs,62941,Calculating a sphere ,1508831500.0,1559,15857238
7lmtyp,gifs,62931,I had 4 dogs climb into my UPS truck looking for treats today,1514034629.0,1111,15857238
6befmm,gifs,62923,Travelled to Japan was not disappointed,1494925717.0,1576,15857238
5m4y2a,gifs,62867,Reflex level German Solider,1483628251.0,1617,15857238
7giwao,gifs,62788,Rollerblading ,1512037217.0,2274,15857238
76y33g,gifs,62763,Ball balancing wire machine,1508270778.0,931,15857238
73lxmk,gifs,62749,The oldest trick in the book,1506897138.0,1016,15857238
7x4noe,gifs,62749,Homer Simpson disappearing in Obama s Smithsonian portrait ,1518503623.0,1398,15857238
5ablu6,gifs,62719,Projection my Brother in law has set up in his front window,1477940536.0,1270,15857238
7q42uo,gifs,62709,You finally meet a great guy who s trustworthy but a little socially awkward,1515873271.0,1645,15857238
7651wx,gifs,62713,Pilot finds creative way to drink,1507932929.0,1203,15857238
729zew,gifs,62651,Crazy man rides the subway on the outside ,1506339845.0,2718,15857238
66ov3i,gifs,62646,Worker offers water to Armadillo looking for groundwater,1492806405.0,1927,15857238
62onqg,gifs,62640,Girl proposes to boyfriend during Kiss Cam,1491028316.0,3962,15857238
4x8tb1,gifs,62597,Grandparents reaction to their grandson winning Olympic gold,1470961105.0,1891,15857238
6jl37z,gifs,62570,The precision of a 1700 year old painting technique ,1498512708.0,1333,15857238
6ei6a0,gifs,62541,I m not sure that s how you use that,1496295367.0,1931,15857238
75gup8,gifs,62506,Plasma Coil Bottle Launcher source tutorial in comments ,1507668938.0,1248,15857238
7qgdhr,gifs,62406,Sorry lady this is mine ,1516009406.0,2437,15857238
7mu4oy,gifs,62399,A winter waterfall,1514580524.0,800,15857238
6vq96l,gifs,62389,I feel I should run from that,1503603421.0,1948,15857238
6d1koa,gifs,62286,from nowhere,1495654674.0,1377,15857238
63bad0,gifs,62292,The Rock learning from the best,1491299741.0,1039,15857238
709pu3,gifs,62218,Girl spinning on bicycle handlebars,1505509699.0,1870,15857238
6uhj9g,gifs,62154,Big man has the moves ,1503088746.0,911,15857238
741kx5,gifs,62134,Strongman competitor moves a car deliberately blocking his Aunt s driveway ,1507077332.0,1878,15857238
72dtez,gifs,62088,First one to the wall wins,1506387851.0,1057,15857238
7uqyry,gifs,61986,Making sure the baby isn t cold,1517603264.0,1064,15857238
6de3z6,gifs,61985,Playing ball with your friend,1495792992.0,795,15857238
7aww9a,gifs,61936,Papa dog meets his puppies for the first time,1509906865.0,1262,15857238
6iy8zm,gifs,61887,The largest moth in North America the Cecropia moth,1498212239.0,2938,15857238
7z1crs,gifs,61839,Shocking Artistry ,1519203619.0,764,15857238
5ay0ws,gifs,61699,A simulation of my girlfriend and the bed covers,1478222353.0,2332,15857238
671u9p,gifs,61682,Toddler Taekwondo is intense ,1492976978.0,968,15857238
5pwm07,gifs,61659,This First Grade PE Class A Cool Way To Get Kids Moving,1485299473.0,2735,15857238
6rv3wy,gifs,61644,Football coach races against a tackling dummy,1502005334.0,1235,15857238
6k7teh,gifs,61448,MMA expectation vs reality,1498765939.0,1361,15857238
7nabxl,gifs,61432,Miku catches treats ridiculously fast ,1514776237.0,716,15857238
5z2yfb,gifs,61433,Someone hates you wherever you go,1489405777.0,612,15857238
7939xg,gifs,61383,Halloween costume by a man who lost his leg to cancer,1509140229.0,446,15857238
53u042,gifs,61338,No look behind the back catch,1474504052.0,1723,15857238
73zocv,gifs,61322,Pangolin,1507057472.0,1856,15857238
4es5f7,gifs,61301,Revolution always comes at the worst times,1460682465.0,1391,15857238
7451g5,gifs,61285,That will teach you not to bump into me on the Catwalk ,1507110099.0,683,15857238
64e6qq,gifs,61272,I bring you The Light ,1491787341.0,574,15857238
6hwcoy,gifs,61215,Aircraft carrier performing a high speed turn,1497768439.0,3463,15857238
7zyxzy,gifs,61174,If you hug one of us you have to hug all of us ,1519529940.0,643,15857238
716i75,gifs,61149,Guy gets pranked by his friend while swimming in South America Friend threw fish food in the water and told him to look out for piranhas ,1505887233.0,1642,15857238
6onusu,gifs,61127,Even death can t save you,1500672022.0,790,15857238
6dbdy7,gifs,61011,The face of a dog that was brought to a shelter Animals don t understand why their pack has abandoned them They just know they re left behind ,1495764654.0,4083,15857238
5a1nv2,gifs,60991,Epic countdown,1477792500.0,803,15857238
6j0jk1,gifs,60957,Sea puppy kisses and one for you too ,1498245355.0,1324,15857238
5kn0ya,gifs,60940,Eyeballs deep,1482912113.0,2177,15857238
82ogd4,gifs,60920,Please let me in Please Please ,1520460118.0,721,15857238
4tb0ql,gifs,60920,My brother made another lamp,1468811079.0,993,15857238
803q01,gifs,60814,We Can Now Fly Using this Hoverboard ,1519583207.0,2904,15857238
65u9wi,gifs,60812,The smile of a Syrian girl who survived a horrible suicide bombing ,1492444432.0,2734,15857238
79pcl4,gifs,60786,The foam pieces I was cutting up were super staticky,1509414256.0,1049,15857238
6qw6al,gifs,60738,So long and thanks for all the fish,1501622508.0,1984,15857238
72tolk,gifs,60614,A Night s Work Caught on Security Camera,1506560786.0,758,15857238
5aj1bc,gifs,60610,This squirrel must be eating the most delicious nut in the world,1478035604.0,1090,15857238
7932u1,gifs,60576,50 year old firefighter deadlifts 600 lbs of flaming steel to celebrate his retirement,1509138130.0,2406,15857238
5rwk0q,gifs,60535,High five,1486184678.0,871,15857238
6hz9bq,gifs,60531,I got you brother Aaaaaarg ,1497815275.0,418,15857238
6bjr4i,gifs,60476,Super excited smoke dude,1494992643.0,1236,15857238
5enc4w,gifs,60471,Skateboarding in high heels,1480015774.0,2043,15857238
688yzx,gifs,60455,Work smarter not harder,1493495598.0,2279,15857238
7rr910,gifs,60415,Caught Pufferfish is released swims away on its back,1516493649.0,1328,15857238
7whyek,gifs,60364,Firehose vs Flamethrower,1518251323.0,1471,15857238
54f8ah,gifs,60291,next day shipping,1474841207.0,868,15857238
67cwi4,gifs,60287,1 life down 8 left to go,1493106242.0,964,15857238
826r9d,gifs,60249,Guess I m still carrying a little holiday weight ,1520292932.0,1063,15857238
6m58gv,gifs,60199,President Trump stops to help pick up Marine One guard s fallen hat,1499598257.0,8735,15857238
52s090,gifs,60169,Mages actually exist ,1473907392.0,1532,15857238
7807hw,gifs,60170,Timber ,1508707928.0,427,15857238
4ypugz,gifs,60119,Japanese face wash x post from r oddlysatisfying ,1471739413.0,1251,15857238
3brsbm,gifs,60108,Last kid just wanted to fit in ,1435798836.0,1239,15857238
7c8h5p,gifs,60051,Lemme show you how it s done,1510437083.0,1025,15857238
6vszlj,gifs,60041,Hey watch me,1503629690.0,913,15857238
6y0o19,gifs,60009,Just do what you love,1504564567.0,1378,15857238
6x826i,gifs,59883,Man returns fish to water after Hurricane Harvey,1504227003.0,2283,15857238
5s0bq3,gifs,59869,Nap time,1486240568.0,589,15857238
4u5qal,gifs,59845,Kendra Harrison when she realized she just ran 12 20 seconds in the 100m hurdles burying 28 year old world record ,1469260500.0,2538,15857238
6njcp8,gifs,59778,Wimbledon fan that was invited to play with the ladies after yelling advice to players from the stands,1500193707.0,1478,15857238
6jdwhv,gifs,59766,Gotta work on those abs,1498419710.0,916,15857238
76dpa7,gifs,59697,No longer needing to appease voters our ex prime minister of Sweden is gradually turning into a troll,1508033208.0,1076,15857238
52c3kp,gifs,59692,You want some of that too fucker ,1473675332.0,1437,15857238
81tqrd,gifs,59654,A thousand sorry s is not enough,1520147066.0,1496,15857238
68q9za,gifs,59615,YOU SON OF A Is that cake ,1493718166.0,1752,15857238
6lif6x,gifs,59593,Cop messes with slow driver in fast lane,1499332453.0,4946,15857238
65eegi,gifs,59588,Someone s gonna be peeved ,1492224518.0,1273,15857238
5tvtvy,gifs,59501,Drone racing in first person view,1487051458.0,2542,15857238
6c1x3x,gifs,59451,Surgical precision,1495203216.0,529,15857238
5dfbd0,gifs,59440,The only British world record that matters,1479410926.0,1748,15857238
5qolpe,gifs,59426,clip clip clip clip clip no,1485652320.0,838,15857238
7a8k2j,gifs,59391,Firefighter administers CPR while descending ladder,1509617826.0,1749,15857238
7rec7h,gifs,59334,83 yo man clings to his beloved cat who was saved from a fire that destroyed their home ,1516350039.0,1051,15857238
6xabdn,gifs,59336,Come on buddy let s go ,1504247160.0,1267,15857238
5tfmkd,gifs,59303,Just a casual handshake,1486857372.0,6739,15857238
5zdnhn,gifs,59268,Sliding down the pole,1489542445.0,1222,15857238
7bvfpp,gifs,59183,Teddy Krueger,1510282645.0,865,15857238
6xvklu,gifs,59150,How to get the jump ball if you are a foot shorter than your opponent,1504499353.0,582,15857238
5nbvew,gifs,59137,A perfect addition to any VR headset,1484166026.0,675,15857238
7w419a,gifs,59039,You wouldn t last 5 seconds in the wild ,1518116309.0,552,15857238
79qegd,gifs,59027,Young fan meets Emma Watson,1509423329.0,1462,15857238
6n5g46,gifs,59003,Got my Soap Bubble Machine to work,1500017890.0,751,15857238
6hgap5,gifs,58994, Spooky Warning My younger brother finished another epic mask ,1497574610.0,1494,15857238
64ajgh,gifs,58983,Scary Realistic Masks,1491728710.0,1107,15857238
4uq0m6,gifs,58956,Electricity finding the path of least resistance on a piece of wood,1469585190.0,1741,15857238
30568i,gifs,58943,Best Day EVER ,1427241592.0,2298,15857238
83d5yi,gifs,58891,The size of Andre the Giants hands,1520687553.0,2051,15857238
77z5hb,gifs,58804,Perfect fit,1508690318.0,1028,15857238
65yeyx,gifs,58687,Dreaming about being a dad,1492492505.0,1482,15857238
772d64,gifs,58648,Helping homeless hermit crab find a new shell,1508309730.0,953,15857238
72la12,gifs,58561,No gym required,1506470070.0,2431,15857238
5c0b5c,gifs,58563,The president America deserved,1478715609.0,6251,15857238
5c4rwf,gifs,58521,Lynx pretends not to be interested in the ball until owner was coming to take it ,1478765874.0,1218,15857238
79yb24,gifs,58516,This kid in an AT ST costume wins halloween x post Star Wars OC ,1509507997.0,697,15857238
7kn1qv,gifs,58431,Sleeping during a live taping ,1513650141.0,514,15857238
6woupm,gifs,58409,solidarity,1504008614.0,1396,15857238
3i2x5b,gifs,58400,Kid is a savage,1440367966.0,1529,15857238
5xx8mp,gifs,58397,Some high quality craftsmanship,1488876395.0,2528,15857238
7878bp,gifs,58316,Baby Pig and Baby Emus Playing,1508788849.0,927,15857238
72fhlm,gifs,58311,Giant rock makes a perfect landing,1506402313.0,1419,15857238
5z0bne,gifs,58258,Guy tricks dog into jumping in his arms,1489374524.0,783,15857238
59q0sv,gifs,58244,Making Faces At Fish,1477625897.0,1281,15857238
62aeaq,gifs,58232,This sphere is coated in Vantablack the darkest pigment ever making it look 2 dimensional,1490859632.0,2998,15857238
4jkhzh,gifs,58216,Learn a trick ,1463422401.0,1062,15857238
41k93c,gifs,58215,Rare footage of a ginger sucking the soul out of his bride,1453170914.0,2385,15857238
807v86,gifs,58216,MJ best moonwalk,1519625053.0,1763,15857238
58msw4,gifs,58207,Nothing wrong with acting like a kid at work,1477079708.0,931,15857238
7zi2kz,gifs,58183,Lol he mad ,1519360260.0,2611,15857238
6htgbr,gifs,58118,Perfect axe throw ,1497735807.0,1238,15857238
4visqn,gifs,58056,Human chain rescue in Maryland last night,1470024913.0,2653,15857238
5qi05q,gifs,58029,What do you have there marine ,1485562925.0,1860,15857238
7f49py,gifs,58013,Ole Miss football player waves to the camera after fumble recovery,1511518129.0,667,15857238
5zknfx,gifs,57890,Burglars caught in the act attempting to break into a property,1489626601.0,2469,15857238
7rwomj,gifs,57861,The smartest Batman goon ever,1516552920.0,1176,15857238
6usx1t,gifs,57864,Hold my wine glass ,1503220462.0,2442,15857238
7dxqd8,gifs,57854,Kittycakes,1511087760.0,1191,15857238
5of617,gifs,57828,Making mum proud,1484646884.0,2252,15857238
4tqxmo,gifs,57826,Trust fall,1469047156.0,879,15857238
5s9o1y,gifs,57796,As 21 00 rolls in 300000 people in Bucharest Romania light up their phones as a symbol of shedding light on corruption,1486355056.0,1271,15857238
7jajlj,gifs,57772,Throwing the selfie stick,1513112187.0,725,15857238
7gukik,gifs,57776,Carpet cleaning,1512158834.0,2976,15857238
5t652j,gifs,57760,Blind dog in the snow,1486743811.0,1129,15857238
69dt5v,gifs,57734,A true hero ,1494007838.0,1298,15857238
5fsktq,gifs,57707,Santa asking what a deaf girl wants for Christmas in sign language,1480572685.0,1276,15857238
6nf6xv,gifs,57696,Tired old man becomes a new excited baby at the motor races ,1500142099.0,1112,15857238
6pbm74,gifs,57592,Sophie Turner is a helpful friend ,1500961275.0,1992,15857238
6l0e5j,gifs,57555,Extreme Scooter Jump,1499122910.0,1516,15857238
6dj06w,gifs,57497,Off to Work ,1495854513.0,2338,15857238
6ebl0f,gifs,57452,Girl with a cute ass,1496221126.0,1200,15857238
792mfi,gifs,57419,Underwater treadmill,1509132372.0,2518,15857238
5jaep1,gifs,57368,The Japanese Prime Minister s Motorcade merges into traffic,1482226027.0,3062,15857238
5nrxdc,gifs,57362,Ridiculous moves,1484357164.0,1564,15857238
7aduyx,gifs,57253,Here comes the fish cuddle ,1509679232.0,1309,15857238
5jt97o,gifs,57248,What a crow ear looks like,1482471734.0,3164,15857238
6s5w82,gifs,57135,Big hill boogie board slide,1502145288.0,2509,15857238
4wbo8h,gifs,57117,Fight or Flight,1470448390.0,1574,15857238
7did7l,gifs,57060,Spectacleular,1510922216.0,560,15857238
65rmzv,gifs,57047,My boyfriend made a remote control lawn mower He s an engineer ,1492408189.0,2163,15857238
7ussem,gifs,57038,There s a baby in there Woah There s a baby in there ,1517620409.0,1704,15857238
78psof,gifs,56862,Bunnies like leaves too ,1508986065.0,463,15857238
62ss6o,gifs,56774,The Divorce Flipbook,1491083089.0,583,15857238
57pjvu,gifs,56766,Hummingbird Scratching Its Ass,1476614697.0,992,15857238
57tdpl,gifs,56765,Not All Student Sections Are Equal,1476678054.0,1282,15857238
6siex2,gifs,56747,Deadpool filming in Vancouver today,1502273393.0,1432,15857238
77bm4q,gifs,56638,UPS delivery with a twist ,1508408955.0,1623,15857238
6mw3zq,gifs,56639,I hear you guys like spinal cord injury recovery gifs Here s one of me walking 1 5 years after an L1 fracture ,1499914835.0,1345,15857238
6tir8d,gifs,56621,Unstoppable,1502697383.0,1352,15857238
579km2,gifs,56620,Happiness,1476383291.0,1406,15857238
7xs6yi,gifs,56602,The brakes on this Volvo,1518746581.0,4000,15857238
5dilyi,gifs,56552,Team sucks so hard they gotta point them to the goal,1479448436.0,527,15857238
4uun5l,gifs,56512,Ruining the moment,1469655525.0,4017,15857238
7rg4e2,gifs,56515,Bless you,1516367919.0,1032,15857238
72w6dx,gifs,56513,Having a little trouble finishing my homework ,1506583385.0,557,15857238
61lt2w,gifs,56497,Donkey is so happy to see his best friend ,1490567409.0,1439,15857238
7bnjyq,gifs,56484,That s enough morning walkie for this good boy,1510196761.0,465,15857238
6unq5i,gifs,56405,Beast mode on,1503155469.0,1799,15857238
5vqrds,gifs,56385,Getting back at your cat for having been an asshole,1487890052.0,1555,15857238
5i2i2o,gifs,56364,My keyboard has a display in each key,1481646116.0,2162,15857238
6p80gn,gifs,56311,Why does everyone waiting in baggage claim always act so crabby ,1500927701.0,1422,15857238
5k810k,gifs,56190,Smoke tricks,1482694277.0,826,15857238
6kbysx,gifs,56192,Japanese toy car has a surprise,1498805072.0,664,15857238
5h9lmb,gifs,56185,Cats do not abide by the laws of Nature,1481260618.0,1545,15857238
7i6zxt,gifs,56159,Dog does what human does,1512687731.0,451,15857238
6h9x02,gifs,56097,Ant sacrifice,1497498179.0,1210,15857238
6jr94e,gifs,56079,Some say she s still flying to this day,1498579112.0,704,15857238
6oquuw,gifs,56063,Cat crunches,1500700003.0,876,15857238
6ap6de,gifs,56039,Bear problem solved,1494591139.0,997,15857238
6jinxy,gifs,55973,It s freaking hot in Arizona,1498475940.0,3477,15857238
7cjk6q,gifs,55861,Brave 93 year old gets his flu shot ,1510563433.0,1775,15857238
5zjqmy,gifs,55850,Wendy is loving this snow ,1489617835.0,577,15857238
55dewj,gifs,55802,Grandfather gets a totally unexpected visit,1475360916.0,1301,15857238
6wywap,gifs,55733,3 year old Prince Harry embarrassing his mother,1504126002.0,929,15857238
78hvf1,gifs,55689,Look at that tail,1508899701.0,915,15857238
74ojd9,gifs,55675,Former Equifax CEO Richard Smith s realization that there is someone dressed as the Monopoly Man behind him during a Senate hearing,1507334288.0,1389,15857238
7ayga6,gifs,55598,Real friends will always be there for you,1509927405.0,746,15857238
52wjn0,gifs,55582,Held his own beer like a boss x post r holdmybeer ,1473980253.0,1019,15857238
72gbun,gifs,55536,Double amputee operates his two robotic arms by thought,1506410387.0,1559,15857238
5w9zm7,gifs,55474,Devastating accident at a fair,1488142844.0,754,15857238
7eupuh,gifs,55466,Doesn t seem like anyone was watching,1511417205.0,809,15857238
619xyk,gifs,55430,Luckily the driver of the second bus knew something was going to give,1490401799.0,1128,15857238
69cfk2,gifs,55426,Snowboarding in style,1493984702.0,1110,15857238
5dp2w2,gifs,55422,Incredibly Happy Dog Being Groomed,1479534497.0,1230,15857238
7gd7q0,gifs,55389,This GIF of Matt Lauer seems inappropriate now,1511990646.0,2174,15857238
7ajyc4,gifs,55382,How to get a free seat,1509750305.0,1504,15857238
632gy3,gifs,55369,He will never know ,1491198249.0,1165,15857238
675h1g,gifs,55371,Pennywise vs Mr Bean,1493018614.0,488,15857238
71a606,gifs,55349,Earthquake on a Boat,1505932279.0,1382,15857238
71k35j,gifs,55348,Oh Deer I didn t know it was occupied ,1506038324.0,724,15857238
6uh67q,gifs,55276,Oh James maybe stick to NBA next time,1503084065.0,1268,15857238
667bqg,gifs,55273,Catch me if you can,1492595853.0,842,15857238
81xkkd,gifs,55243,Keanu Reeves helping girl in Cinderella dress onto motorcycle,1520197793.0,1295,15857238
5k3kub,gifs,55191,This is what happens if you try to steal a Rolls Royce ornament ,1482623397.0,2106,15857238
6bodu0,gifs,55169,He just wants a hug,1495053198.0,1602,15857238
66k82k,gifs,55127,Curtain Raiser,1492747045.0,1210,15857238
7vn19i,gifs,55106,Assigned seating,1517949372.0,1839,15857238
4zup1t,gifs,55004,Unique skateboard trick,1472340679.0,1228,15857238
68nreq,gifs,54980,What sorcery is this ,1493692249.0,879,15857238
6u7l3i,gifs,54948,Smooth,1502972156.0,1065,15857238
6qv9gw,gifs,54851,I d say she s a keeper,1501610788.0,542,15857238
7iyf58,gifs,54829,Putting the game into your own hands ,1512983002.0,462,15857238
5qfzn8,gifs,54673,Cat is a great goal keeper,1485533183.0,760,15857238
63qgxl,gifs,54657,Two Fish Spitting Sand At Each Other,1491477262.0,1350,15857238
6fxiye,gifs,54650,My dog thinks we can t see her,1496910209.0,623,15857238
78sna1,gifs,54583,Shark screen,1509013344.0,930,15857238
7dfle4,gifs,54554,Robot BackFlip,1510895732.0,1768,15857238
6a4d1j,gifs,54496,Superman Catch ,1494350943.0,1724,15857238
66jayg,gifs,54465,Catching a foul ball,1492738771.0,842,15857238
6m0hk6,gifs,54455,Biker meets a future biker,1499541960.0,1702,15857238
5m6m6x,gifs,54457,in australia even the sky wants to kill you,1483654763.0,1057,15857238
755m8j,gifs,54383,Skateboarding into the night,1507538425.0,474,15857238
7n46jv,gifs,54311,lovely family,1514697890.0,1016,15857238
6k1x8p,gifs,54265,WTH is happening in here,1498698070.0,2057,15857238
70xsje,gifs,54222,iPool party,1505795582.0,542,15857238
5p6ir4,gifs,54185,Trump s first act as President,1484974284.0,1255,15857238
71nbaw,gifs,54103,Cop s got spirit yes he do ,1506067474.0,1650,15857238
7wvyj5,gifs,54024,Kid stuck macaroni up his nose dad had to get it out ,1518415295.0,1675,15857238
748gww,gifs,53972,Matt Damon forgets his line checks the subtitles for a reminder ,1507155925.0,374,15857238
7unuvg,gifs,53941,A ball sucked into a treadmill,1517564368.0,852,15857238
7y5ogq,gifs,53933,Doggo has mad skills ,1518887359.0,715,15857238
3hcofa,gifs,53922,A gorilla s gentle reminder that he could easily kill you,1439868716.0,3370,15857238
5eu9jl,gifs,53918,Feather starfish moves around in an oddly calming way,1480119000.0,1085,15857238
7uvb04,gifs,53898,Cat becomes a can t ,1517640871.0,512,15857238
5h6i6v,gifs,53898,Boy helps his sister do her hair,1481226539.0,1331,15857238
67334s,gifs,53900,A magician caught doing a sick magic trick behind an interview,1492993260.0,673,15857238
5sb4zz,gifs,53892,Mailman doing donuts in the snow,1486371546.0,1181,15857238
6f1wzn,gifs,53873,Robot wrestling just in case you havent seen something this cool before,1496534486.0,990,15857238
57xr25,gifs,53813,You re right not all student sections are created equally,1476745175.0,1707,15857238
34fztl,gifs,53799,he best reversed gif I have ever found,1430455864.0,1831,15857238
74bip2,gifs,53750,Glowing Sand Art,1507182843.0,567,15857238
4oodob,gifs,53725,This dog figured out you can stand in the pool ,1466282910.0,1020,15857238
701u2g,gifs,53635,Michael Jackson gliding like a robot across the stage,1505420208.0,2530,15857238
5v21e3,gifs,53607,i am lion ,1487586581.0,550,15857238
63zrdc,gifs,53561,Crossfit Gone Awry,1491592521.0,2306,15857238
7vtkcf,gifs,53479,Bad hair day,1518006418.0,4515,15857238
5f7e8s,gifs,53481,Using tilt shift at a carnival in Rio makes it look like something out of Gulliver s Travels,1480308138.0,663,15857238
6zo422,gifs,53450,Groom is really happy to see his bride,1505262753.0,1029,15857238
6j9t4u,gifs,53289,The sound of a F1 car going past in GIF form,1498359041.0,804,15857238
5cr2tt,gifs,53278,Salmon Swimming Across the Road,1479088498.0,1126,15857238
7wn5v8,gifs,53261,Korean drummer girl loves her job,1518315906.0,1312,15857238
5ziozt,gifs,53251,Jedi with a GoPro x post from r starwarsgifs ,1489604581.0,1282,15857238
4din8a,gifs,53194,Here we have the trick called the salmon,1459921080.0,1045,15857238
567dia,gifs,53192,Transparent TV screen Cupboard door,1475812732.0,1611,15857238
76qzb0,gifs,53186,Must kill WATER ,1508194376.0,506,15857238
6gtovf,gifs,53173,Hermit Crab,1497317197.0,916,15857238
7yaq2y,gifs,53173,Cow scratcher,1518942467.0,1189,15857238
6pglaj,gifs,53151,My hotel had a robot butler to deliver items to the room,1501022847.0,1943,15857238
4v81ij,gifs,53136,This dude wanted to play with the balloon too until he realized he was standing next to Hillary Clinton ,1469845489.0,2690,15857238
62u4bs,gifs,53114,Respect 41 year old Steve Alexy battling cerebral palsy and still giving his all at the gym,1491096394.0,1171,15857238
4qgzh8,gifs,53063,Roombas Beer pong,1467252560.0,1422,15857238
6t9mfr,gifs,52968,Demon Cat Activated,1502586719.0,929,15857238
5chgjy,gifs,52959,Incredible Proposal,1478933635.0,2287,15857238
4w6mva,gifs,52958,Hiding a TV in a sliding door,1470371595.0,2120,15857238
5peibo,gifs,52878,Clever girl,1485079667.0,1168,15857238
50zecb,gifs,52865,How to dad,1472946945.0,1009,15857238
801tre,gifs,52719,Human are you seeing this sh t ,1519557291.0,614,15857238
54i8tm,gifs,52709,Surprise m therfucker,1474881638.0,1919,15857238
67serf,gifs,52678,Dessert,1493283724.0,722,15857238
68f2vj,gifs,52665,Little girl got a nice surprise when she got home,1493581637.0,1691,15857238
7w662i,gifs,52665,Stack of dimes weld,1518137475.0,2066,15857238
6913f5,gifs,52656,Bodycam shows officer jumping into a pond after he sees a little boy fall in,1493854733.0,3203,15857238
5gzg5f,gifs,52583,Dubai under a sea of clouds,1481139798.0,2414,15857238
6r3gqu,gifs,52564,Cat trying something new,1501701293.0,1416,15857238
6x6ofv,gifs,52551,Zebra Crossing,1504212985.0,2508,15857238
7mmgdu,gifs,52510,98 year old Grandpa tests his boxing skills,1514494741.0,996,15857238
5glr53,gifs,52414,The result is perfect,1480971362.0,589,15857238
7hd7al,gifs,52343,Porthole view,1512371709.0,1059,15857238
764qk8,gifs,52256,Modern day Sisyphus,1507929761.0,1309,15857238
7bf7yd,gifs,52245,Kids will be kids,1510108850.0,877,15857238
4bwm0l,gifs,52246,Filming a rap video,1458944013.0,1760,15857238
5ae6fs,gifs,52207,A good prank,1477968990.0,1439,15857238
5g3aeq,gifs,52176,Hot Potato without the potato,1480714740.0,2064,15857238
6bsu65,gifs,52110,Man uses energy shield to block MMA fighter s punches ,1495096610.0,3452,15857238
60nkiz,gifs,52110,White men can t what ,1490131761.0,2720,15857238
77wq7u,gifs,52106,An early breaking the fourth wall joke from 1920,1508656355.0,987,15857238
6j5pri,gifs,52070,Camp Director promises the kids ice cream if he makes this shot,1498299621.0,799,15857238
7kh642,gifs,52061,Hanging lounger swing,1513581158.0,1068,15857238
5kkepd,gifs,51990,Kid gets official adoption notice for Christmas,1482883551.0,1717,15857238
