id,subreddit,score,title,timeCreated,numComments,subscribers
7wwmpv,gifs,211171,Spectator at PyeongChang,1518421507.0,1783,15857238
5jrlw1,gifs,204189,1 dad reflex 2 children,1482454655.0,5715,15857238
7s6y7w,gifs,189201,Finnish ski jumping team,1516667795.0,1976,15857238
781imr,gifs,172722,Bush cracks joke to Obama while Clinton makes a speech,1508721399.0,7576,15857238
7oz6np,gifs,170044,Letting the horses out in the snow ,1515453846.0,2582,15857238
76ivjw,gifs,167370,Courtney Love warning about Harvery Weinstein in 2005,1508102083.0,7071,15857238
6hpx3r,gifs,166674,Some dude in a Brazilian supermarket,1497681761.0,2159,15857238
7ldc7d,gifs,164082,It s all downhill from here ,1513927239.0,5510,15857238
7czj3d,gifs,163668,Oh you think this is a game ,1510728558.0,3353,15857238
770205,gifs,160071,Woman rips off burqa after ISIS is driven from Raqqa,1508289583.0,6649,15857238
7ryou7,gifs,158555,Fighting litter with crows,1516581478.0,3879,15857238
7pkmxw,gifs,156797,That was fast ,1515663836.0,4493,15857238
7phaej,gifs,153411,Snow face ,1515635529.0,1556,15857238
7ye3l5,gifs,148614,A wild young monkey is welcomed back by his family when he is released after 3 weeks of treatment for a leg injury,1518987732.0,1905,15857238
7dngpv,gifs,145317,Great officiating,1510976805.0,2339,15857238
7trh1x,gifs,144788,Let me show you a trick,1517251118.0,1748,15857238
7pcjqm,gifs,144662,I wonder if the roads were any better,1515581129.0,4470,15857238
5fk6rm,gifs,142160,Found an old linerider course I made in middle school ,1480471810.0,2106,15857238
6l2i41,gifs,141824,Buzz Aldrin s reaction to Trump s space speech,1499143145.0,6509,15857238
64h08g,gifs,141678,I took the gif of the bird landing on the street light and turned it into a movie production intro,1491820094.0,1691,15857238
7aepg6,gifs,141033,Two dudes make their own party outside the club,1509686606.0,3641,15857238
6i6y02,gifs,140862,Shaq sees everything from up there,1497913271.0,1360,15857238
7huajk,gifs,139736,Enjoy the moment,1512549762.0,1415,15857238
7qbx7x,gifs,139153,Teachers 16 year old cat passed away and students surprised her with a new one ,1515966572.0,3511,15857238
7tnm2g,gifs,138633,A gentleman,1517206897.0,1982,15857238
6c45t5,gifs,136868,Leonardo DiCaprio gets his Oscar engraved,1495234803.0,3026,15857238
6elqtw,gifs,135946,Just Putin this out there,1496339890.0,3030,15857238
7ot52z,gifs,135821,Attachment for wheelchairs ,1515386145.0,1594,15857238
65w44v,gifs,135531,The President gets reminded to be patriotic,1492470653.0,10105,15857238
7olqh8,gifs,132695,Involuntary Super Saiyan transformation,1515299583.0,1869,15857238
7b18ae,gifs,132269,Lambo drivers don t need to pay parking,1509953558.0,3419,15857238
6ubws0,gifs,131007,An Elephant Got Caught on Security Camera Picking Up Trash and Putting it in a Garbage Can,1503022875.0,2809,15857238
6f40c0,gifs,129459,Someone tries to throw a rock through this restaurant s window guy catches it mid air with his beer still in hand ,1496558530.0,2579,15857238
6gsaqb,gifs,128484,Save the skateboard ,1497303947.0,3051,15857238
59txr0,gifs,128262,How to make your dog s day,1477683525.0,2277,15857238
6ko9yg,gifs,126581,Spinning a skateboard wheel so fast the centripetal force rips it apart,1498959108.0,3537,15857238
7oavma,gifs,126532,Living with a fox,1515183696.0,3404,15857238
60wtw3,gifs,126209,Hot Fuzz guys spotted in the London Attack,1490239867.0,2957,15857238
7f6xec,gifs,125195,Dog saves woman from getting robbed,1511551931.0,2661,15857238
7zkuqn,gifs,124153,You would not believe how many tries this took me ,1519383776.0,2744,15857238
7tukka,gifs,122671,Kingfisher keeping its head stable,1517280935.0,1797,15857238
7u9xzb,gifs,122603,Trust the lights,1517434863.0,4065,15857238
5xcx63,gifs,121779,Camera shutter speed synced to helicopter s rotor,1488602987.0,2480,15857238
7ngxb3,gifs,121706,An incredible 540 spinning kick,1514862872.0,2722,15857238
7sgdzm,gifs,119309,Dad prevents crash ,1516760112.0,2723,15857238
6rkw26,gifs,118496,I wanted a hidden table and couldn t find what I wanted online so my boyfriend and I built it ,1501886431.0,3876,15857238
77ta2n,gifs,117940,Slow reaction time,1508620340.0,2151,15857238
721jnn,gifs,117722,US soldiers in Vietnam hear the radio report that they re going home,1506236231.0,3006,15857238
7en2n3,gifs,117629,Cute kitty loading Wait for the cuteness ,1511343105.0,1536,15857238
7xas9p,gifs,117024,There are three types of people,1518569913.0,1890,15857238
7al7np,gifs,116864,Sam get the holy water ,1509761559.0,1683,15857238
7edwei,gifs,116838,Infant unit nurses when the earthquake hits the hospital,1511255153.0,3836,15857238
627mma,gifs,115899,Trump Signs his Energy Independence Executive Order,1490833115.0,6684,15857238
7lw7kq,gifs,115665,Santa is on his way ,1514164291.0,1312,15857238
7gqp7w,gifs,115109,Singapore building structure ,1512113703.0,3268,15857238
69ygz4,gifs,114748,Wrapping a joint the right way ,1494283133.0,3140,15857238
7u1hgo,gifs,114161, Quit messing around someone s going to get hurt ,1517352489.0,4505,15857238
7lknmo,gifs,114024,Drunk Smoke Tricks ,1514009389.0,1974,15857238
7q1qft,gifs,113722, What just happened ,1515839182.0,2252,15857238
6v2n27,gifs,113575,What really happens during an eclipse,1503348082.0,1026,15857238
69n1oe,gifs,113503,Finish Her ,1494127759.0,1683,15857238
6gaoik,gifs,113486,Wife How s your day going Me ,1497065504.0,2494,15857238
5v6jrn,gifs,113261,Perfect paper airplane setup,1487647258.0,1347,15857238
71vgj2,gifs,113174,These girls out here gettin down when suddenly ,1506159101.0,3364,15857238
82xdcn,gifs,112958,Clean sweep,1520543554.0,1612,15857238
80pozn,gifs,111955,Lowland Gorilla doesn t want to get his knuckles wet,1519791450.0,2400,15857238
7d6e21,gifs,111672,A glitch in the matrix,1510801791.0,2094,15857238
6xe3pt,gifs,111630,Handless little boy cares for his newborn sibling,1504296595.0,2596,15857238
7yrmoz,gifs,111585,Wholesome moment at the Olympics,1519114986.0,1675,15857238
7k7mbb,gifs,110973,Amazing save ,1513467593.0,1895,15857238
8212fr,gifs,110929,Dog shares the other half of her biscuit,1520230634.0,1436,15857238
78uo3s,gifs,110739,Gentleman,1509042574.0,2656,15857238
6qd4s4,gifs,110394,Punch activated flamethrowers,1501387809.0,2821,15857238
7xq54o,gifs,110341,Hey where d you go ,1518727854.0,935,15857238
5zu0b2,gifs,110248,Wearing a green tie on television,1489734253.0,2238,15857238
7gognz,gifs,109811,Owner reunites with dog that was missing for 12 days ,1512095604.0,2686,15857238
60a59y,gifs,109412,Goose is so happy to see his friend,1489960588.0,2384,15857238
72c465,gifs,109320,Starting a conversation in style,1506371589.0,2219,15857238
5tu88n,gifs,108365,Trudeau didn t get pulled in ,1487036186.0,10179,15857238
6fi5lf,gifs,107812,Marine on a rowing machine,1496735745.0,3960,15857238
6o9fe3,gifs,107712,10 hour time lapse of an Amish barn raising,1500508880.0,5013,15857238
7j3705,gifs,107429,The inventor of the ladder chair shoes,1513037865.0,2262,15857238
7hz2ob,gifs,107424,Morning commute on the 405 in LA today,1512606152.0,4243,15857238
80wm1q,gifs,107392,These VR apps are getting out of hand,1519858554.0,807,15857238
682e21,gifs,107171,Once a gymnast always a gymnast,1493412207.0,1434,15857238
82v2xa,gifs,107118,Stuck the landing,1520514881.0,1108,15857238
712gj1,gifs,107072,Blind cat gives his favourite pianist a hug every time he hears him play ,1505851018.0,1324,15857238
5nv97h,gifs,106569,How to tell if baby is awake back there ,1484392575.0,1925,15857238
7dcu3z,gifs,106228,Motorcycle rider jumps across train tracks as police try to stop him,1510872465.0,4075,15857238
6b16aa,gifs,106069,He doesn t know it s impossible,1494750498.0,1879,15857238
5i8jvg,gifs,105927,if you draw hands on the small McDonald s hot cup it looks like a butt If you poke a hole in it ,1481718191.0,2240,15857238
6mzlyn,gifs,105888,Obvious attempt at insurance fraud caught on camera,1499952130.0,802,15857238
7y1049,gifs,104518,Always wear your PPE,1518836235.0,2222,15857238
7kdtgn,gifs,104501,Taking Star Wars to a new level,1513546839.0,2297,15857238
7fr2jz,gifs,104372,98 year old Pearl Harbor survivor is honored before the game still ready to make a play,1511770800.0,1493,15857238
6sdbax,gifs,104332,This is the most GTA thing ever seen ,1502226031.0,1964,15857238
7x1q34,gifs,103814,The joy of owning a cat,1518480308.0,2619,15857238
5n9p0e,gifs,103631,VP Joe Biden reacts to President Obama calling him the best decision he made as a nominee,1484133096.0,3531,15857238
66wssv,gifs,103232,8 year old Tilly s first couple of seconds wearing a bionic hand ,1492906787.0,4017,15857238
7xa8af,gifs,103168,John Cena being a genuinely good guy,1518565386.0,3363,15857238
82gvz8,gifs,103152,So happy to see you ,1520386601.0,1181,15857238
6acq2n,gifs,103027,Proper Etiquette by the Prince of Norway,1494451414.0,4322,15857238
4vv0sa,gifs,102727,Leonardo DiCaprio scaring Jonah Hill on the street by pretending to be a crazy fan,1470202919.0,2950,15857238
7rdku7,gifs,102562,Boy surprises his stepdad who raised him with adoption papers for his birthday ,1516343450.0,2783,15857238
7vqjmr,gifs,102451,Two Falcon Heavy side core rockets landing simultaneously,1517979531.0,2246,15857238
5dgrex,gifs,102349,Mom Reflexes,1479429472.0,2249,15857238
79vej3,gifs,102341,Skull carved out of 646 colored pencils ,1509481890.0,1217,15857238
81emcp,gifs,102289,She broke a string,1520030181.0,1329,15857238
7lqeea,gifs,102195,Guy builds his own prosthetic arm using Lego ,1514085093.0,1883,15857238
6e7k4u,gifs,102097,Train seat in Japan,1496182141.0,3183,15857238
62m7g8,gifs,102078,Spicer during a press conference,1491006145.0,2700,15857238
7nqdub,gifs,102027,Sibling Prank ,1514964428.0,1579,15857238
7b9t3d,gifs,101870,Stealing money from Uber driver s tip jar,1510046598.0,7720,15857238
669rxj,gifs,101814,Loose tire,1492632566.0,3373,15857238
739h8s,gifs,101784,Baby dolphins fascinated by squirrels,1506736118.0,2233,15857238
64xh3k,gifs,101777,Not on my watch,1492024187.0,2423,15857238
7ocazj,gifs,101389,Football with storm Eleanor,1515198617.0,1505,15857238
7l2qmw,gifs,101234,Dog hugs his owner after undergoing surgery ,1513818568.0,1824,15857238
6nbfbr,gifs,101117,Elderly man gently combs his sick wife s hair,1500090544.0,2684,15857238
5p59im,gifs,100873,Bill Clinton is a savage Got caught checking out Ivanka by Hillary,1484962292.0,5801,15857238
81rlms,gifs,100844,Multitasking is hard,1520127464.0,1327,15857238
7uze5z,gifs,100070,Builder makes friends with client s dog ,1517694519.0,1482,15857238
6lwhby,gifs,99890,Trump shaking hands with Putin,1499488464.0,3546,15857238
75jp96,gifs,99472,season ends before class does ,1507694338.0,2210,15857238
748xgj,gifs,99184,Fantastic trolling at the US Senate hearing on the Equifax data breach,1507160154.0,1438,15857238
70zmnz,gifs,99134,Man sentenced to jail after camera in popular animal dumping spot catches its first perp,1505813152.0,8114,15857238
7imr4t,gifs,98994,Thieves are stopped while fleeing from a warehouse,1512855390.0,2559,15857238
75tgmq,gifs,98857,Wild bunny accepted me,1507797589.0,2489,15857238
71qpi1,gifs,98467,Pickpocket in action,1506112708.0,4894,15857238
7m80ap,gifs,98408,Bear enjoying a frozen stream,1514327143.0,1355,15857238
7bxnv5,gifs,98363,The only time a catch was really important,1510303330.0,1593,15857238
6pnwxa,gifs,98270,Thanks United ,1501103420.0,3079,15857238
80561n,gifs,98245,Why did you trick me human ,1519602064.0,904,15857238
6z8mr6,gifs,98208,It s gone from bad to worse in Miami,1505083933.0,2116,15857238
7xe1wj,gifs,98191,Obama s actual portrait,1518596760.0,2440,15857238
73t40j,gifs,97827,People donating blood in Las Vegas,1506983540.0,3148,15857238
6mohff,gifs,97698,A few months ago I posted a gif of my paralyzed self walking in an exoskeleton and lots of redditors donated to my recovery fund That money allowed me to spend the last five weeks at Shepherd Center doing physical therapy and cool stuff like this Thanks Reddit ,1499829383.0,1904,15857238
6vlzqy,gifs,97686,Visiting Dad at work,1503550874.0,1464,15857238
6v7qze,gifs,97635,Vaping By A Freeway,1503394448.0,1901,15857238
832ck0,gifs,97623,Gentle tapping ,1520582692.0,2276,15857238
5bpkac,gifs,96900,Holly Molly Fire Works One Single Shell Nuclear ,1478588717.0,1832,15857238
613hwr,gifs,96744,Corn Breakdance,1490321081.0,859,15857238
6ymbre,gifs,96684,Smart little bird understands how motion sensors work,1504808488.0,1696,15857238
6g12cm,gifs,96309,Alpha Gorilla Blocks the Road While His Band Crosses,1496958691.0,3431,15857238
7ymw73,gifs,96242,Whassup bitches ,1519078392.0,1074,15857238
7e4785,gifs,96211,Interesting slo mo on the road,1511160503.0,2125,15857238
7jh59m,gifs,96201,The fast lane ,1513172089.0,1766,15857238
6cfyqn,gifs,96072,Policeman absolutely loves prank,1495392983.0,1146,15857238
6u265u,gifs,96058,Interlocked watermelon carving,1502920432.0,1435,15857238
80loae,gifs,95523,Popeye in 1936 Impressive 3d background effect,1519758818.0,1757,15857238
5h0xb6,gifs,95518,Grandma don t give a fuck,1481157777.0,1369,15857238
7qoum3,gifs,95285,Never forget this shot ,1516095576.0,1520,15857238
7j5r1a,gifs,95159,The magic of happiness,1513058373.0,1137,15857238
6zwqgo,gifs,95138,Jack Black to the rescue ,1505358100.0,1538,15857238
7znp5w,gifs,94856,Don t touch my food ,1519417879.0,2384,15857238
6jnxe3,gifs,94694,Beach roller coaster made from lego,1498539378.0,1259,15857238
7p6xx2,gifs,94613,Holy shit I actually caught it ,1515531775.0,1769,15857238
6gek9m,gifs,94586,That s my chair ,1497118911.0,1109,15857238
6ly2tz,gifs,94538,Double boardslide with a side of fabulous ,1499504989.0,1392,15857238
77ii24,gifs,94460,100 to 0 in seconds,1508487065.0,1580,15857238
69qcgs,gifs,94316,True meaning of life,1494175441.0,998,15857238
5ropyl,gifs,94223,Arnold s response,1486091022.0,5457,15857238
6418yf,gifs,94211,Guy on a roller coaster inauguration gets hit by pigeon,1491609484.0,2956,15857238
731um0,gifs,94186,See it doesn t hurt ,1506650344.0,1126,15857238
7iu7r6,gifs,94161,This glass pane has a secret dimension hidden inside,1512945543.0,1720,15857238
6i5ni7,gifs,94120,A little help please ,1497898340.0,2040,15857238
6tfyq8,gifs,93984,Brochures distribution Only in China ,1502669696.0,1665,15857238
7f04c0,gifs,93887,I just met you but I think I love you,1511477706.0,1743,15857238
77qhmd,gifs,93868,Marriage Proposal,1508577102.0,3791,15857238
7sot2x,gifs,93747,Zoo penguins is so happy that it snowed ,1516844492.0,1597,15857238
5x5htw,gifs,93543,This man is a professional,1488513093.0,2110,15857238
5j1vhr,gifs,93213,Had a bit of icy weather in Maryland,1482118183.0,1538,15857238
7ran33,gifs,93204,Driving without a child seat surprise ,1516319977.0,2198,15857238
8259gr,gifs,93149,Guess what is the biggest preventable cause of cancer after smoking ,1520277629.0,4227,15857238
5yid78,gifs,93041,Genius,1489128364.0,1034,15857238
64syyz,gifs,92368,Grandfather sees color for the first time,1491966513.0,4325,15857238
6nhmz8,gifs,92242,Gang Violence Going Down ,1500173758.0,1441,15857238
7fump4,gifs,92169,Octopus uses a shield of shells to defend itself against a shark ,1511811960.0,1950,15857238
5ez1r8,gifs,92103,Black Friday madness in Canada ,1480187606.0,4428,15857238
7rpqn1,gifs,91986,16 year old BMX rider does insane flair whip,1516473895.0,1656,15857238
7u6pcf,gifs,91972,Did Bernie leave the gas on at home ,1517396180.0,4303,15857238
6avlkc,gifs,91935,Master of the Wind,1494671528.0,1369,15857238
6wfq89,gifs,91082,Eyes On The Prize,1503906979.0,1567,15857238
67fdkg,gifs,91020,Ermahgerd the beach ,1493139513.0,1078,15857238
7c2vr3,gifs,90967,Marriage proposal test run,1510366687.0,2086,15857238
76cgmf,gifs,90935,This guy should be the new team mascot,1508020747.0,1550,15857238
6mf6he,gifs,90831,Chameleon fascinated by water tap,1499729539.0,1603,15857238
7zwg6p,gifs,90795,Fleabot leaps tall building in a single bound,1519506108.0,2618,15857238
7a3iss,gifs,90659,Tips mustache,1509571353.0,1188,15857238
7x7cj3,gifs,90612,Guy can surf,1518529787.0,1260,15857238
7oqs3a,gifs,90549,LED cube,1515363549.0,1388,15857238
6at2a3,gifs,90538,Dog keeps girl from wandering too far out in the ocean ,1494642307.0,2449,15857238
7mlzxz,gifs,90532,Thanks for saving me you fucking asshooooooooooooooooole,1514487959.0,1713,15857238
6cyqvb,gifs,90471,Underwater in crystal clear quality,1495614775.0,1651,15857238
7wpyji,gifs,90432,After it rains in mellieha Malta ,1518343102.0,1104,15857238
5vu7tk,gifs,90047,Dog uses bread as bait to catch a fish,1487924196.0,1801,15857238
71cj03,gifs,90018,Good kid spots neighbor s dropped wallet in driveway returns it ,1505956183.0,2627,15857238
72mhqc,gifs,89958,This is the most Canadian way to get bears to leave your garden ,1506480439.0,1270,15857238
7m1yzo,gifs,89960,Dad gets a Christmas present ,1514246014.0,1063,15857238
63l4nq,gifs,89828,That s the smoothest slide,1491423130.0,1388,15857238
6pk18d,gifs,89607,World s First Standing Double Backflip on a Tumbling Floor,1501053152.0,2617,15857238
5iotuy,gifs,89544,Deep Sea Ghost Shark filmed alive for first time,1481931076.0,2632,15857238
7sx1fw,gifs,89418,Is that him It s him He s home ,1516924916.0,1931,15857238
6bv610,gifs,89361,Waking a Cat up with an Airhorn,1495129384.0,1615,15857238
7t4ux8,gifs,89339, I refuse to be caged ,1517005951.0,2229,15857238
7ztlon,gifs,89308,Fire Department Saves Dog after a House Fire ,1519467848.0,1491,15857238
6wcpcm,gifs,89006,Mike Tyson dodges a flurry of blows and then ends it ,1503875924.0,2537,15857238
7n8n6t,gifs,88979,Car full of Berners,1514758249.0,2638,15857238
75pwfh,gifs,88768,Come here buddy ,1507765415.0,2123,15857238
6xp1qy,gifs,88691,The amazing beer flip,1504415677.0,1460,15857238
67hzji,gifs,88616,Referee does the splits to avoid interfering with the ball,1493169458.0,1560,15857238
6rz5oa,gifs,88523,Not much is known about the dance of the Hooded Grebe except that it is pretty weird,1502064378.0,1206,15857238
7lp2pt,gifs,88382,Excuse us just passing through,1514070764.0,2221,15857238
6xgwk0,gifs,88304,Trying out a VR slide,1504323424.0,1889,15857238
71hi7c,gifs,88240,Near Disaster Averted,1506006772.0,1136,15857238
6gmjgt,gifs,88134,There there it ll be okay human,1497230203.0,1611,15857238
6znphr,gifs,88010,2017 Father of the Year nominee,1505259193.0,1733,15857238
6d9ntl,gifs,87936,Pope Francis also doesn t want hold Donald s hand,1495748283.0,1918,15857238
68bbpb,gifs,87747,So you can actually screw them off,1493524354.0,1811,15857238
7we0ll,gifs,87498,My kid s preschool added something special yesterday to the solar system diorama they made last week ,1518217680.0,1542,15857238
6efdcm,gifs,87411,Mom hears her son s heart beat again in transplant recipient,1496270392.0,3031,15857238
6ree5k,gifs,87007,Kids having a great time diving into the river,1501814030.0,3029,15857238
7et3dx,gifs,86967,Head on collision caught on security cam,1511404161.0,2419,15857238
83nkkl,gifs,86961,Working a night shift when time changes,1520813122.0,1591,15857238
6f9tfo,gifs,86854,Someone left the door open dog sneaks over to his favourite spot,1496639433.0,1474,15857238
82n0i1,gifs,86733,Banana filling ,1520443241.0,443,15857238
5sllrm,gifs,86726,Police officer helping out,1486505722.0,1745,15857238
761wrg,gifs,86582,This Guy Spins,1507890859.0,2008,15857238
81tqpi,gifs,86280,Have you ever seen an angry unicorn ,1520147053.0,956,15857238
7srhpv,gifs,86215,The judge tossing aside a letter from convicted child molester Larry Nassar is a thing of beauty ,1516865469.0,6384,15857238
6bh8oy,gifs,86164,Dog Protecting His Human,1494967523.0,3832,15857238
5s1jn4,gifs,86029,Obamas on the kiss cam ,1486255099.0,3585,15857238
726br8,gifs,86013,Sly,1506302112.0,1152,15857238
73xj6f,gifs,86011,Smooth ,1507025816.0,452,15857238
7mf9uh,gifs,85935,Animal Gaits,1514413357.0,1349,15857238
6v5s1n,gifs,85726,Satellite Imagery of 2017 Solar Eclipse,1503375742.0,1594,15857238
6d6kaf,gifs,85558,Congratulations I am dumb,1495704757.0,1304,15857238
6dt3a7,gifs,85230,Thanks Satan,1495995010.0,1185,15857238
6kt0pv,gifs,85134,Scarecrow,1499027713.0,1136,15857238
5qvbge,gifs,85098,Frozen pike eating a bass,1485744378.0,1480,15857238
6iopao,gifs,84979,Who made this mess ,1498107039.0,880,15857238
4s1pdc,gifs,84864,Footage of helicopter going down too fast,1468119662.0,1665,15857238
69u26j,gifs,84842,Textbook tornado,1494222941.0,1619,15857238
6631fs,gifs,84776,Helping an elderly lady cross the street,1492553341.0,2811,15857238
7kopvl,gifs,84723,The Flash K9 ,1513664725.0,1589,15857238
7zom8t,gifs,84727,Bird photobombs meteorologist,1519426811.0,1275,15857238
7io8nq,gifs,84712,Wonder Woman meets Superman,1512871125.0,3036,15857238
5fgvta,gifs,84689,Great execution and form,1480425852.0,1296,15857238
82bhhk,gifs,84515,Cool birthday cake candle,1520330711.0,1234,15857238
7tkgak,gifs,84417,Subway staredown,1517177758.0,1206,15857238
7th6r8,gifs,84340,Dolphins with Gray Whales for scale,1517131704.0,1639,15857238
6uw3zf,gifs,84302,Trying to open a portal to the birb dimension ,1503269452.0,1057,15857238
753tfz,gifs,84253,Sharing is caring ,1507519827.0,1339,15857238
7qwra6,gifs,84193,Incredibly skilled Inline Freestyle champion Feng Hui,1516175317.0,1752,15857238
7cvrwc,gifs,84172,Lemme knock on the glass tank,1510696990.0,2401,15857238
6x4dzy,gifs,83944,A cow trying to catch snowflakes ,1504178297.0,4784,15857238
76w4v0,gifs,83727,How to impress the ladies at work ,1508242240.0,3183,15857238
5gwvyk,gifs,83709,Cat dunking,1481101866.0,1126,15857238
7s5cfl,gifs,83696,Bill Murray at the Mark Twain Prize event for David Letterman ,1516651862.0,1505,15857238
7y2r62,gifs,83642,Olympic level hair reveal,1518851444.0,1114,15857238
6nfvbz,gifs,83642,Nope You are Fake Horse,1500153254.0,1037,15857238
6gfgr6,gifs,83596,Glitch in the matrix spotted,1497133267.0,1527,15857238
7cfnc9,gifs,83362,Cat like reflexes,1510525646.0,1009,15857238
6yf8bn,gifs,83284,Ace ,1504728674.0,1491,15857238
75wmgo,gifs,83206,He has no excuses to give,1507839761.0,3714,15857238
626anb,gifs,83160,This little boy asked his mom if he could go hug the police officer,1490819121.0,3407,15857238
7xvdsu,gifs,83066,Tiger on thin ice ,1518774045.0,1395,15857238
7wtebr,gifs,82881,Teach shows off his skateboarding skills to his students,1518392073.0,1213,15857238
63t7w7,gifs,82712,HD Night Vision camera,1491517328.0,2687,15857238
6w3aj0,gifs,82446,Connor McGregor s arms are ready for anything,1503745409.0,1112,15857238
62392d,gifs,82348,Flippin unbelievable ,1490774875.0,2584,15857238
7nujbi,gifs,82318,Now that s just overkill,1515013779.0,2772,15857238
76u35n,gifs,82288,Jason Pierre Paul s sack celebration last night was a celebration he learned from a young fan who was battling cancer ,1508220929.0,929,15857238
7co5lw,gifs,82196,Come a little bit closer,1510618711.0,1731,15857238
7p2tg1,gifs,82130,Parking in a handicap spot without a tag is a bad idea in Brazil ,1515483400.0,1909,15857238
69govl,gifs,82076,Sit Good boy ,1494040449.0,562,15857238
7vbe63,gifs,82018,The awkward kid during Superbowl half time,1517824398.0,2479,15857238
7gaou6,gifs,81899,Skylight reimagined eh ,1511960148.0,1655,15857238
736wfv,gifs,81902,WTF happened to Carl ,1506708721.0,852,15857238
7udo61,gifs,81872,That s some nice calligraphy you got there ,1517464797.0,932,15857238
7kmcky,gifs,81844,This cat had her leg amputated but still tries to scratch her ear with it,1513644094.0,1433,15857238
4yco62,gifs,81723,Celebrating with her coach,1471560576.0,1305,15857238
5p6pet,gifs,81673,He can t believe his luck,1484976174.0,2031,15857238
72rdbq,gifs,81618,Highway to Hell,1506536843.0,2398,15857238
6o14qv,gifs,81577,This dog is like a shadow ,1500417260.0,2061,15857238
7noeaf,gifs,81560,Why s it following me though ,1514947660.0,902,15857238
7ojbgf,gifs,81545,Even if you re a cop ball is life ,1515275253.0,1701,15857238
829cu3,gifs,81453,Give me my damn ice cream,1520312818.0,1760,15857238
833nu9,gifs,81336,Mark Hamill got his star today,1520594848.0,1224,15857238
7yqx11,gifs,81220,The next Wayne Gretzky,1519109025.0,1558,15857238
68wohs,gifs,81166,Oh you re home ,1493796160.0,912,15857238
73w7wu,gifs,81069,Carhop,1507011691.0,1221,15857238
7b5eti,gifs,80962,Kid is really invested in his phone game,1510006924.0,2796,15857238
73rnoj,gifs,80880,Hey ,1506963531.0,660,15857238
7mcbb6,gifs,80858,Post Mower,1514371982.0,1291,15857238
5gdiga,gifs,80767,How to free your dog from a kangaroo choke hold,1480850782.0,5148,15857238
6q48ee,gifs,80760,Dutch police giving trauma teddies to childeren just after a car crash ,1501281865.0,2962,15857238
6bymo8,gifs,80420,Boomerang skills,1495165710.0,1137,15857238
7m3lzr,gifs,80414,The Cone Flip ,1514265153.0,551,15857238
5yyd8f,gifs,80397,Thomas the train creepy face swap,1489348742.0,1042,15857238
5fxnod,gifs,80197,Awesome self leveling spoon for people with arm impairment,1480640324.0,1973,15857238
5stlbs,gifs,80167,Airport traffic is the worst,1486599357.0,1432,15857238
6a8u84,gifs,80042,Best Fidget Spinner Trick Ever,1494398111.0,3670,15857238
5pko2g,gifs,80011,Tornado broadcast interrupted by dog on lawnmower,1485157344.0,679,15857238
7t0vcj,gifs,79803,Snow Time lapse,1516956276.0,1248,15857238
6kqdby,gifs,79762,Insanely lifelike robotic fish in Japan,1498982896.0,1762,15857238
5vo8c6,gifs,79755,Just a guy taking down the Confederate Flag on live TV,1487853112.0,9503,15857238
6exixg,gifs,79736,My blind foster kitten getting off the cat condo ,1496470041.0,1282,15857238
6dgs7x,gifs,79711,Kid shows his true colors at the game,1495832309.0,2146,15857238
6l3pbl,gifs,79451,Okay smart guy let s see you do it agai ,1499156167.0,1048,15857238
