id,subreddit,score,title,timeCreated,numComments,subscribers
1u83m2,behindthegifs,1824,Let s get the ball that is this sub rolling This took a wopping 4 minutes ,1388691989.0,17,229092
30kffs,behindthegifs,1817,Lady in the streets,1427542448.0,43,229092
28t2s6,behindthegifs,1821,He promised it will be awesome,1403489194.0,56,229092
2wabuu,behindthegifs,1814,Societal Protections Have Failed,1424269179.0,28,229092
2pwe3r,behindthegifs,1807,Martin s Short lived Career,1419125857.0,96,229092
513ot6,behindthegifs,1809,Pawlice Action,1473018950.0,36,229092
7n7f6l,behindthegifs,1801,Standin or We All Know That One Guy ,1514736515.0,44,229092
3zqgy2,behindthegifs,1807,An announcement to all cats of Earth,1452126082.0,43,229092
341dw3,behindthegifs,1795,Skills Of A Samurai,1430176920.0,47,229092
2uwxkk,behindthegifs,1795,Estebans Time For Glory,1423201075.0,29,229092
4k17pt,behindthegifs,1798,Poor Pacman gets suffering,1463668911.0,40,229092
1ygdwn,behindthegifs,1796,The cutest rap battle,1392945534.0,70,229092
57iadi,behindthegifs,1798,It s simple kill the Batman ,1476502859.0,25,229092
3hcv6o,behindthegifs,1798,Alaskan hardcore doggystyle massage parlor SFW ,1439871479.0,47,229092
5akau0,behindthegifs,1794,Bilbo Stuck in a Tree,1478048998.0,57,229092
24p4y0,behindthegifs,1792,National Geographic really stepped up it s game,1399246198.0,30,229092
4a5kp1,behindthegifs,1792,The hero the city deserves,1457846758.0,53,229092
1u88d0,behindthegifs,1787,Dad s F cking DEAD ,1388698601.0,15,229092
442cof,behindthegifs,1783,It seemed like a good idea at the time,1454568333.0,36,229092
2bum4y,behindthegifs,1766,You had one job Linda ,1406485906.0,46,229092
4h9zq4,behindthegifs,1773,For my father ,1462150620.0,68,229092
1vfsk1,behindthegifs,1766,Oh Samantha,1389983461.0,79,229092
3lv7vg,behindthegifs,1766,Bad Trip,1442905376.0,22,229092
33bwlv,behindthegifs,1765,We re a happy family,1429628833.0,41,229092
2czacn,behindthegifs,1764,Gold Medal Gymnast,1407535081.0,55,229092
3epfnu,behindthegifs,1759,The little umbrella that could ,1437979561.0,20,229092
3xbndy,behindthegifs,1732,The Last Booty Call,1450456462.0,49,229092
3p8px7,behindthegifs,1733,The journey to utopia,1445214743.0,69,229092
2iexm9,behindthegifs,1731,The final hope of a doomed world ,1412593790.0,37,229092
2xul0r,behindthegifs,1728,A penguin in flight,1425456810.0,171,229092
1v84ed,behindthegifs,1720,And they never spoke again ,1389766612.0,29,229092
34ilm8,behindthegifs,1720,Bounce Bounce Bounce Bounce,1430516716.0,63,229092
3g89pv,behindthegifs,1716,Love Arachtually,1439055409.0,52,229092
3sfqx9,behindthegifs,1715,Simple and straightforward Multitrack drifting ,1447296745.0,52,229092
1vmmhj,behindthegifs,1716,Secret of the Greasy Controller,1390203532.0,30,229092
3lop40,behindthegifs,1709,The final battle,1442793391.0,50,229092
2aac2g,behindthegifs,1715,Sometimes you just can t help yourself,1404978997.0,37,229092
3j3a86,behindthegifs,1712,The only correct choice ,1441061318.0,47,229092
2ru41w,behindthegifs,1715, and this is why he ll never trust again ,1420816559.0,36,229092
1u8kr9,behindthegifs,1708,Mrs Rivers saves the day with a delicious treat ,1388709901.0,34,229092
422s6f,behindthegifs,1705,Life s A Beach,1453448803.0,18,229092
2i07d7,behindthegifs,1700,Some people never get over High School,1412211295.0,49,229092
3qz5bl,behindthegifs,1686,The lost brother,1446335575.0,60,229092
233j1g,behindthegifs,1684,Secret Defensive Undercover Operations,1397603304.0,59,229092
3exd69,behindthegifs,1680,The great escape,1438135665.0,21,229092
1u846t,behindthegifs,1674,Waffle Falling Over gif,1388692802.0,21,229092
2bvb9h,behindthegifs,1674,Imagine if he was a pole dancer,1406509954.0,29,229092
21kzec,behindthegifs,1675,Mmm strawberries ,1396030612.0,32,229092
3t52xh,behindthegifs,1670,Ride the Champion,1447783735.0,37,229092
3zxnr9,behindthegifs,1668,What to do when you can t grow a beard,1452231346.0,26,229092
27d7lp,behindthegifs,1667,Work that workplace helmet,1401984035.0,30,229092
1vxrb0,behindthegifs,1668,Secret mission,1390509429.0,42,229092
28llw0,behindthegifs,1663,Jim s had it with that bitch s shit ,1403252642.0,22,229092
26ztvm,behindthegifs,1666,Kanye Mess,1401610770.0,121,229092
27fwhp,behindthegifs,1652,Axis of Kawaii,1402053832.0,86,229092
3gmhjy,behindthegifs,1660,Typical Jenkins,1439347078.0,14,229092
4xu543,behindthegifs,1654,Collateral damage,1471304287.0,35,229092
22fzjt,behindthegifs,1652,The Dark Scorpion Rises,1396922804.0,64,229092
2lvai5,behindthegifs,1654,Special Italian Seasoning,1415664780.0,60,229092
82lgwm,behindthegifs,1649,Today s Special,1520424635.0,28,229092
2edttw,behindthegifs,1650,Deer Debate,1408848120.0,31,229092
23g41k,behindthegifs,1651,Honest day s work,1397956706.0,24,229092
2ulmo4,behindthegifs,1649,The eel said no hugs ,1422965234.0,63,229092
4b83v9,behindthegifs,1649,Kung Fu Orange,1458519190.0,20,229092
1vwi57,behindthegifs,1632,Leg Day,1390468449.0,40,229092
3de16z,behindthegifs,1626,You better watch your back meow ,1437002279.0,23,229092
6vkhqd,behindthegifs,1625,Chelicembrace,1503537775.0,39,229092
2c80t9,behindthegifs,1624,Robocop s always getting himself into wacky situations ,1406822782.0,34,229092
26k31i,behindthegifs,1619,A Tire can Dream,1401172970.0,52,229092
4h4wlb,behindthegifs,1618,Gear up boys He s mine ,1462059727.0,35,229092
249gv7,behindthegifs,1625,Angry garbage bin,1398789364.0,33,229092
1yejoc,behindthegifs,1615,I m your only son ,1392892245.0,35,229092
2yxiyk,behindthegifs,1614,Hottest Party in Town bonus panel in comments ,1426297084.0,78,229092
2lj2xr,behindthegifs,1609,it does work ,1415348355.0,86,229092
6kd6rc,behindthegifs,1595,Taking the Bullet,1498818909.0,17,229092
2jmtt5,behindthegifs,1590,If I was a giant invisible worm I d be a dick too ,1413691980.0,53,229092
26qodw,behindthegifs,1596,Don t test me ,1401348894.0,19,229092
71zrgw,behindthegifs,1589,Love Is in the Air,1506217926.0,20,229092
353o4u,behindthegifs,1585,Pool Master,1430974733.0,44,229092
66w2k5,behindthegifs,1586,Sign 5 Cat spies on you when you re in bed,1492898223.0,15,229092
2wc1us,behindthegifs,1585,Attraction Isn t a Choice bonus panel in comments ,1424311586.0,41,229092
5tszis,behindthegifs,1574,Kitty Hawk,1487023214.0,17,229092
2alguh,behindthegifs,1580,The Fight of a Lifetime,1405300922.0,36,229092
2ip8m9,behindthegifs,1571,Don t Worry Morty I got this,1412833166.0,64,229092
1yo60p,behindthegifs,1571,Crazy Cat Fanatics,1393149903.0,28,229092
3e6tj1,behindthegifs,1576,The lazy Corgod and his planetballs,1437595412.0,13,229092
1u9e9y,behindthegifs,1564,Deer Late for Work,1388728175.0,20,229092
2stupx,behindthegifs,1565,Today will be better sorry for the terrible drawings ,1421616914.0,43,229092
28yo22,behindthegifs,1569,Plus in would be be delicious ,1403644672.0,56,229092
6jlar3,behindthegifs,1567,Just go into the light,1498515028.0,44,229092
4ahvs2,behindthegifs,1562,Do it ,1458066995.0,49,229092
2j2v96,behindthegifs,1556,A Race Against Time,1413195144.0,44,229092
1u877t,behindthegifs,1556,Catch ,1388697142.0,15,229092
3i05ma,behindthegifs,1538,Dude Mel be cool ,1440303120.0,56,229092
5d91cw,behindthegifs,1537,To the pain,1479329884.0,24,229092
40dwtg,behindthegifs,1533,Where the heck did that snowman come from ,1452497797.0,18,229092
1z3vgy,behindthegifs,1539,Cue the training montage ,1393555767.0,40,229092
3f7nyf,behindthegifs,1535,The hot date,1438321287.0,40,229092
5t6jmf,behindthegifs,1529,Scary movie,1486751201.0,16,229092
1uvbc8,behindthegifs,1530,Super Friends to the Rescue ,1389370316.0,43,229092
2635yf,behindthegifs,1525,At the hide and seek tournament ,1400668920.0,46,229092
2w1fqo,behindthegifs,1519,Marvin shops at woodco,1424086496.0,22,229092
286y8e,behindthegifs,1519,Top Gear Makes a VW Ad,1402854600.0,99,229092
1y03xn,behindthegifs,1515,Lazer Man vs Jetstream,1392522509.0,102,229092
40o86s,behindthegifs,1511,Three Wishes Part 3 Bonus btg in comments ,1452659132.0,49,229092
1vpi89,behindthegifs,1515,Overly active corgi,1390285006.0,14,229092
3ogi9u,behindthegifs,1512,Must Warn Master,1444690845.0,36,229092
626c9b,behindthegifs,1504,The Breakfast Express,1490819689.0,32,229092
22l4ld,behindthegifs,1510,Meanwhile wandering lost in a desolate desert ,1397051712.0,14,229092
3r38u1,behindthegifs,1506,The grass is always greener on the other side multi gif ,1446421831.0,35,229092
454edx,behindthegifs,1504,Web Savvy,1455160422.0,51,229092
2n1pvd,behindthegifs,1508,Hurdle star,1416652690.0,38,229092
7er1f4,behindthegifs,1503,They ll Roo in the Games,1511387261.0,16,229092
1vrcza,behindthegifs,1500,Tape Measure Retribution,1390340042.0,15,229092
4yj6g8,behindthegifs,1494,Fear the master of Slav Maga,1471645238.0,32,229092
63c75n,behindthegifs,1495,Gold diggers,1491311472.0,13,229092
2z8hgl,behindthegifs,1492,The path to the other side ,1426545417.0,102,229092
2pgq2m,behindthegifs,1494,Hygienic Hi jinx,1418762933.0,24,229092
246xit,behindthegifs,1494,The Terror of the Night,1398727603.0,32,229092
21q19b,behindthegifs,1490,A mission of utmost importance ,1396179500.0,17,229092
44enfx,behindthegifs,1493,Laundry is hard I m not kitten you ,1454761131.0,19,229092
5ba30f,behindthegifs,1488,Vinnie s Lament,1478384184.0,49,229092
3e33y3,behindthegifs,1484,Street War,1437524290.0,67,229092
30tdv9,behindthegifs,1477,Temple of Jo rmungandr,1427758747.0,58,229092
77yysg,behindthegifs,1477,Allied Ducks Encounter Hostile Blyat Flak,1508686737.0,80,229092
7rqovv,behindthegifs,1472,A Spirit and His Dog,1516487671.0,14,229092
2dryzt,behindthegifs,1474,I m coming for you friend ,1408278458.0,45,229092
2ocgmf,behindthegifs,1464,Dealing with a homophobic coworker,1417793663.0,44,229092
3y1qkh,behindthegifs,1462,Pretty Fly for a White Spi Bonus Comic in Comments ,1450961104.0,48,229092
2s9xyq,behindthegifs,1454,Attack on Planet Cat ,1421181954.0,22,229092
2hj7cp,behindthegifs,1456,The last stand against the Libertarian Monster,1411772820.0,41,229092
6bayd5,behindthegifs,1451,Just 87 Octane,1494889915.0,28,229092
545axv,behindthegifs,1452,We Need To Stop This Reindeer ,1474673898.0,39,229092
1upxxi,behindthegifs,1449,Tired of getting chewed up by everyone ,1389228494.0,12,229092
3q6951,behindthegifs,1443,Facing his fears,1445824726.0,22,229092
22uxfx,behindthegifs,1442,Tyrannical Budgie,1397345965.0,24,229092
3nmzxh,behindthegifs,1435,A world of pure imagination ,1444116504.0,36,229092
2h975g,behindthegifs,1439,Urban Jungle Episode 143 A Sandy Doom,1411528041.0,50,229092
1wwr4b,behindthegifs,1434,A Deal with the Devil,1391479619.0,23,229092
30hure,behindthegifs,1426,Of course the cat is scared of a dragon ,1427496297.0,50,229092
46gd20,behindthegifs,1421,Contortionist Lawsuit,1455851168.0,15,229092
3id6p4,behindthegifs,1425,A Robot s Dream ,1440556895.0,37,229092
43vxn1,behindthegifs,1412,When Negotiations Break Down,1454471537.0,17,229092
7xtib5,behindthegifs,1416,Flying in comfort,1518757204.0,34,229092
3943fv,behindthegifs,1413,Solving the Blart case ,1433847448.0,39,229092
1xvw74,behindthegifs,1403,Hey r behindthegifs You are Subreddit of the day Congrats ,1392398885.0,43,229092
1ubvp1,behindthegifs,1400,Shredding the box solo ,1388804500.0,21,229092
226wj8,behindthegifs,1405,The war of the ants,1396649507.0,54,229092
2sgbzr,behindthegifs,1398,magic glasses,1421305173.0,61,229092
274gcp,behindthegifs,1392,Picard s Gift from Q,1401756351.0,52,229092
52q3q9,behindthegifs,1393,Cat Fight,1473883215.0,24,229092
20j24e,behindthegifs,1391,Lion Pride,1394969940.0,26,229092
20zq32,behindthegifs,1365,Sweet dance moves,1395436027.0,42,229092
4yt5ar,behindthegifs,1362,Is there in truth no dessert ,1471782863.0,28,229092
3co4aa,behindthegifs,1358,Bark VS Bark,1436473800.0,34,229092
356iah,behindthegifs,1355,TURTLE CAT ,1431038982.0,9,229092
2ytmhc,behindthegifs,1361,Confessions of the Damned bonus panels in comments ,1426214409.0,28,229092
2bmzq3,behindthegifs,1356,A noble beast A noble effort ,1406269631.0,62,229092
2wixv8,behindthegifs,1348,Say hello to my little friend,1424445063.0,27,229092
20bj81,behindthegifs,1347,Catnip is just a gateway drug ,1394750690.0,26,229092
33nqyj,behindthegifs,1340,Alien Porn,1429865291.0,36,229092
49rwjf,behindthegifs,1338,Three Wishes Part 4 Homage,1457612012.0,37,229092
25sbuv,behindthegifs,1336,Cats against Climate Change,1400357235.0,17,229092
4kic5m,behindthegifs,1340,Show her you like her But don t kill anyone ,1463948379.0,29,229092
1v4wdf,behindthegifs,1335,Will you just make up your mind already ,1389676477.0,25,229092
4z09r7,behindthegifs,1339,The abyss stares back,1471897404.0,20,229092
2jk4zn,behindthegifs,1333,Another Faceplant Adventure,1413614027.0,43,229092
3feqr9,behindthegifs,1329,Lonely Larry learns to love ,1438468113.0,26,229092
1we9b1,behindthegifs,1324,Construction Holding Up Traffic ,1390967295.0,55,229092
41zewr,behindthegifs,1312,Kumo Senpai,1453401739.0,48,229092
4b4rrh,behindthegifs,1304,Life Choices,1458450186.0,14,229092
1y23vn,behindthegifs,1306,Flight of the bumblebees first post ,1392585918.0,38,229092
2fxx7b,behindthegifs,1298,Broritto,1410324545.0,16,229092
6mm2ag,behindthegifs,1283,The Blow Brothers Episodes 1 3,1499806986.0,26,229092
37zfb9,behindthegifs,1286,High Tide 2015 ,1433125548.0,36,229092
343xmf,behindthegifs,1286,Steven Ball T A tough choice,1430217621.0,25,229092
2r5sah,behindthegifs,1282,Robot World Cup,1420277888.0,42,229092
2pyls7,behindthegifs,1277,I wanna hold your hand,1419180553.0,81,229092
3h06e9,behindthegifs,1266,Danny falls in love,1439604781.0,66,229092
4csckg,behindthegifs,1265,Not a Spi but Still Pretty Fly ,1459491038.0,31,229092
1urvkk,behindthegifs,1263,Little Dog s Magic Mirror,1389271331.0,36,229092
28qwnh,behindthegifs,1264,The book of death,1403413178.0,20,229092
1uwq4f,behindthegifs,1267,World s Largest Slingshot,1389415562.0,13,229092
228lr6,behindthegifs,1259,Lost at sea and hungry ,1396688730.0,42,229092
2nj5wg,behindthegifs,1255,Gotta fix this before I go to work ,1417077616.0,22,229092
3pyukb,behindthegifs,1252,Mudskipper problems,1445670592.0,31,229092
1u87ze,behindthegifs,1246,I think I m addicted to making these,1388698141.0,14,229092
1ue1nx,behindthegifs,1241,Pussy Magnet,1388872380.0,17,229092
2uc93v,behindthegifs,1241,My first BTG Do you even lift bro ,1422767130.0,25,229092
5mgqcn,behindthegifs,1243,The oldest joke in the book ,1483771102.0,17,229092
5pkquq,behindthegifs,1233,Making America again,1485158123.0,134,229092
3khli4,behindthegifs,1229,To Boldly Go ,1441965618.0,37,229092
1w82mz,behindthegifs,1224,Penguin King,1390801706.0,13,229092
2w46s9,behindthegifs,1225,Waffles,1424149181.0,67,229092
6ckdts,behindthegifs,1223,Excuse me,1495446002.0,29,229092
2an9uj,behindthegifs,1224,Revenge of the tree s,1405347123.0,53,229092
2bgwpf,behindthegifs,1213,The Chimera,1406121416.0,105,229092
255bz9,behindthegifs,1212,I don t want to live on this planet anymore ,1399688840.0,49,229092
22wcfu,behindthegifs,1204,Your move Bergeron,1397385838.0,11,229092
2ese3p,behindthegifs,1212,a routine check up,1409223598.0,60,229092
3gwf3v,behindthegifs,1207,Maria s Chance ,1439530687.0,27,229092
1ubz1q,behindthegifs,1208,Send to ,1388806532.0,14,229092
3l7nwg,behindthegifs,1203,Hold up in Subsection 237,1442462304.0,58,229092
39eo7m,behindthegifs,1201,A fight for love,1434030432.0,19,229092
1wagb6,behindthegifs,1201,Getting Crazy Up in Meercat Manor,1390870528.0,20,229092
3z5pbl,behindthegifs,1190,Love at First Sting,1451782238.0,38,229092
209gzb,behindthegifs,1189,Their only chance,1394687552.0,50,229092
2pnwcs,behindthegifs,1187,Ice Cube finally killed someone,1418916483.0,54,229092
276yvd,behindthegifs,1184,A sex change is no joke,1401823794.0,70,229092
208ccu,behindthegifs,1181, And Down The Stretch They Come ,1394663979.0,22,229092
3lsrhi,behindthegifs,1183,Mystical Chimp Brings A Little Ass To The Party,1442868126.0,52,229092
4buqqz,behindthegifs,1177,Don t Mess with the Mantis,1458900387.0,47,229092
1wlucu,behindthegifs,1175,Goodbye old friend ,1391158710.0,43,229092
1ueag9,behindthegifs,1174,Bad dog no biscuits ,1388881621.0,16,229092
23riq9,behindthegifs,1175,Tranquilizer Dysfunction,1398287061.0,64,229092
6euhby,behindthegifs,1172,Cat 4 vs Tail 4 Round 9 ,1496440152.0,10,229092
47y2ik,behindthegifs,1166,Teenage Mutant Ninja Turtles vs Late Twenties Weird Karate Bird,1456636618.0,15,229092
269b4c,behindthegifs,1168,A spooky story,1400834214.0,17,229092
29z3vx,behindthegifs,1164,Miss of the meadows beauty contest,1404692019.0,19,229092
1z3c6c,behindthegifs,1161,A tragic romance ,1393544918.0,22,229092
6pioo7,behindthegifs,1162,Danger Mouse The Live Action ish Reboot,1501040768.0,52,229092
1ugq71,behindthegifs,1160,Everyone will love my report ,1388966523.0,31,229092
3yc3vg,behindthegifs,1152,Cat Court Episode 1 The Purrfect Crime ,1451200461.0,16,229092
7egf8p,behindthegifs,1144,Destroying the scroll,1511282202.0,12,229092
24js4b,behindthegifs,1143,Road Rage Mario,1399074507.0,85,229092
1ughob,behindthegifs,1137,Steve finally gets his big break ,1388956300.0,23,229092
2kdkj4,behindthegifs,1136,Dan dooms the entire ship ,1414367899.0,84,229092
3mlhcc,behindthegifs,1130,The biggest joint,1443403508.0,20,229092
3uevpx,behindthegifs,1134,A little extra firepower,1448616291.0,46,229092
2abcfj,behindthegifs,1130,The tyranny ends here,1405005492.0,27,229092
2264xj,behindthegifs,1126,Soccer ball ,1396618746.0,26,229092
1wv858,behindthegifs,1126,So Graceful reformatted ,1391430999.0,16,229092
2bivd4,behindthegifs,1125,Butch Chewy Scratchy s Lament,1406172520.0,66,229092
4i1g2v,behindthegifs,1124, is everywhere you see,1462504252.0,149,229092
23a56e,behindthegifs,1118,Sploosh ,1397782140.0,27,229092
4qs4l9,behindthegifs,1121,The All New All Different Lambda Squad,1467413535.0,47,229092
6cusp6,behindthegifs,1116,Unwanted Solicitor,1495576542.0,21,229092
6t9g81,behindthegifs,1117,Got your fastpass for the Twister ,1502584913.0,15,229092
448nl4,behindthegifs,1105,More Girl Talk with Wolfie and Katipo,1454666580.0,69,229092
1u8a7f,behindthegifs,1109,The Guacamole Trick,1388700683.0,14,229092
1uw6d3,behindthegifs,1105,Hamburglar or Hamhero ,1389403242.0,38,229092
2983os,behindthegifs,1105,The Behemoth,1403883297.0,18,229092
283l3j,behindthegifs,1098,I m not just spinning you a yarn,1402737319.0,12,229092
4efdlk,behindthegifs,1089,Kill The King,1460482998.0,40,229092
434m56,behindthegifs,1080,The Beebz,1454034840.0,56,229092
3h0noq,behindthegifs,1077,This is for you dad,1439611902.0,40,229092
265hx4,behindthegifs,1068,PROJECT DOOMST d AY,1400734989.0,36,229092
3s6xh2,behindthegifs,1069,National Treasure 3,1447136533.0,32,229092
2oei5a,behindthegifs,1066,These Gas Station Burritos Really Suck,1417844830.0,38,229092
23uzi4,behindthegifs,1059,Party Capsule,1398377904.0,24,229092
2bvdxt,behindthegifs,1061,Sonic doesn t stand a chance ,1406511743.0,23,229092
2lu9em,behindthegifs,1060,No Time to Spare,1415632936.0,41,229092
3jywsy,behindthegifs,1048,You want your hand free don t you ,1441660523.0,44,229092
1y8szu,behindthegifs,1048,Pacman gets lost,1392763729.0,18,229092
786fri,behindthegifs,1040,A true gentlemen ,1508777211.0,25,229092
2a9q6h,behindthegifs,1033,Best Birthday Gift Ever,1404965744.0,19,229092
5jebil,behindthegifs,1030,Too many emotions to bear,1482281914.0,27,229092
42e5g0,behindthegifs,1031,roll for initiative,1453632366.0,42,229092
1u8ajj,behindthegifs,1028,Damnit it was expensive ,1388701027.0,12,229092
2y1aqs,behindthegifs,1026,Terrance The Magnificent,1425602443.0,94,229092
1whx0k,behindthegifs,1025,Have at you ,1391059167.0,36,229092
1ubxt3,behindthegifs,1024,John s drug problem has really been escalating ,1388805769.0,19,229092
2ynh6k,behindthegifs,1025,Martial Inspiration,1426082761.0,19,229092
1x1q9b,behindthegifs,1017,Rude buns,1391598612.0,28,229092
3nj3ln,behindthegifs,1013,Scary ugly,1444043163.0,15,229092
21ak2y,behindthegifs,1009,Agent Bun,1395746982.0,23,229092
3puul1,behindthegifs,1004,When the Master isn t home,1445596433.0,51,229092
2nzreu,behindthegifs,998,The Price of High Fashion,1417507814.0,24,229092
2bu0m8,behindthegifs,999,skin cancer is no laughing matter,1406461824.0,16,229092
1vuked,behindthegifs,999,Too Smart,1390426371.0,12,229092
3f31pt,behindthegifs,999,Indiana s bones,1438235884.0,17,229092
4v03mk,behindthegifs,993,Minion daycare,1469731805.0,41,229092
43puqq,behindthegifs,996,He s That Guy,1454380537.0,56,229092
34zv3y,behindthegifs,987,Express Yourself,1430895409.0,41,229092
2mgj14,behindthegifs,990,Alternative Therapy,1416165170.0,47,229092
2xfbqk,behindthegifs,984,George s Fear,1425121044.0,9,229092
1uljd2,behindthegifs,977,Spidey with the smooth moves,1389096422.0,19,229092
739ew5,behindthegifs,972,Zebras,1506735558.0,20,229092
2ualn8,behindthegifs,970,Everyone Needs A Place To Stay,1422728036.0,88,229092
2ln53s,behindthegifs,969,Merry Christmas sweetheart ,1415444641.0,31,229092
1ut25y,behindthegifs,969,Restroom,1389315593.0,17,229092
1vfzeq,behindthegifs,973,True Love,1389992951.0,12,229092
21go2g,behindthegifs,969,Vegan Contraband,1395907880.0,29,229092
4zzawh,behindthegifs,964,Romehowl Mewliet,1472418467.0,20,229092
21wcto,behindthegifs,966,Jim needed a friend,1396357512.0,9,229092
20qoo1,behindthegifs,961,There is no spoon ,1395198491.0,23,229092
1zqii4,behindthegifs,963,The Outing,1394157717.0,33,229092
4bwwdb,behindthegifs,958,Supreme Commander 3,1458948302.0,16,229092
205ql1,behindthegifs,956,Bros before cardio,1394592137.0,32,229092
1w5shj,behindthegifs,959,Death ray conundrum ,1390729334.0,18,229092
47mw9f,behindthegifs,955,Never was a story of more angst than this of Spromeo and Juliants Bonus in comments ,1456482098.0,50,229092
25ydvn,behindthegifs,956,Poseidon s Second Coming,1400548150.0,22,229092
406z5l,behindthegifs,958,Fish Fight,1452387004.0,30,229092
2lgi9u,behindthegifs,954,Karate Kid A difficult beginning,1415292418.0,26,229092
4zbvvl,behindthegifs,950,At the car wash,1472063145.0,16,229092
57ej3c,behindthegifs,945,A Toy s Last Resort,1476446139.0,20,229092
2q1a79,behindthegifs,938,There s a fire burning in my heart,1419249156.0,53,229092
4e68dl,behindthegifs,936,Paranoischizopuss,1460331719.0,6,229092
4val5z,behindthegifs,934,Dropping Keys,1469881295.0,9,229092
3h2d6o,behindthegifs,921,Jaws 6 Chelicerae,1439642628.0,34,229092
1u8b8v,behindthegifs,913,Just another day in the workplace nsfw ,1388701739.0,27,229092
1u8exs,behindthegifs,911,The hot dog smuggler,1388705172.0,29,229092
3xhsb3,behindthegifs,913,Ping Pong Tournament,1450581034.0,16,229092
422vx8,behindthegifs,908,A conflagration most severe,1453450303.0,29,229092
28440c,behindthegifs,907,Getting in shape,1402753947.0,29,229092
26wsky,behindthegifs,900,Grounded Chihuahua,1401515936.0,16,229092
3euxib,behindthegifs,896,Saving the Environment,1438085147.0,50,229092
34qru4,behindthegifs,897,A Dying Corg s Wish,1430709100.0,39,229092
1uxhn6,behindthegifs,895,New Watch,1389434192.0,8,229092
589udb,behindthegifs,893,Say what,1476906621.0,45,229092
2erjhv,behindthegifs,895,That s just rude ,1409204752.0,47,229092
2olw8q,behindthegifs,894,K9 s Worst Nightmare,1418035549.0,31,229092
28g8ii,behindthegifs,889,This is my fight ,1403118368.0,32,229092
3zv4y2,behindthegifs,897,Three Wishes Part 2 Bonus BTG in Comments ,1452195589.0,13,229092
2dql8e,behindthegifs,891,Intimacy is a lie we all believe ,1408242136.0,25,229092
2a8koe,behindthegifs,894,The Kitten Feud,1404942247.0,25,229092
7ogzni,behindthegifs,889,Just Jump Neo ,1515240988.0,17,229092
299wbw,behindthegifs,884,Lab Grown Shelters NSFW ,1403933653.0,14,229092
2by0eg,behindthegifs,882,SECOND BTG ATTEMPT I m calling it the wizard ENJOY ,1406584747.0,33,229092
1viay6,behindthegifs,879,She just wanted to eat in peace ,1390054491.0,23,229092
3273j1,behindthegifs,871,Paper A Plane s Redemption,1428752463.0,34,229092
1wb7v9,behindthegifs,870,Behind the plow,1390885774.0,18,229092
6yi5dr,behindthegifs,864,Danger Mouse 2 Dangerer Mouse,1504757256.0,56,229092
21mmc9,behindthegifs,867,Cat repulsifier ,1396073456.0,11,229092
3t94lt,behindthegifs,857,The motivation he needed to follow his dream ,1447849164.0,10,229092
3risy4,behindthegifs,861,Full Metal Bollards,1446689891.0,20,229092
3285i1,behindthegifs,853,A Matter Of Taste,1428785884.0,51,229092
22iq6z,behindthegifs,860,Never overfill your handbag ,1396997656.0,24,229092
337q49,behindthegifs,859,Indoor canine siege,1429547683.0,22,229092
1unan8,behindthegifs,855,Magnetic Eclair,1389152944.0,29,229092
4phba9,behindthegifs,849,Selfie Lover,1466724802.0,15,229092
22eisg,behindthegifs,847,The story behind r StoryGifs,1396875840.0,64,229092
2itw1h,behindthegifs,841,Anger Issues,1412945724.0,23,229092
1ub553,behindthegifs,837, r behindthegifs sets a new Reddit record Most subscribers within the first day of subreddit creation No other subreddit grew so fast on its first day ,1388784043.0,64,229092
2prjtl,behindthegifs,834,Step Up Arachninsanity,1418998680.0,18,229092
2l0wxl,behindthegifs,830,A Rod and the Rash ,1414918107.0,24,229092
3nb5hk,behindthegifs,827,Best Buds,1443874207.0,6,229092
1vg4oh,behindthegifs,832,Just be smooth Joey ,1389998010.0,12,229092
1viyvq,behindthegifs,828,Julie overreacts,1390088378.0,19,229092
3v8sqz,behindthegifs,816,The Adventures of Randolph,1449148097.0,29,229092
6t55d5,behindthegifs,809,Love is for the birds ,1502524408.0,37,229092
1ytzp0,behindthegifs,810,Why the hate Vlad ,1393308580.0,13,229092
1wc16v,behindthegifs,800,Death Nip,1390902203.0,17,229092
2a68m8,behindthegifs,802,A Moving Pallet Farewell,1404878468.0,51,229092
2dfoq1,behindthegifs,800,Crazy Paul goes shopping ,1407965638.0,28,229092
2lf92z,behindthegifs,806,BY OUR POWERS COMBINED,1415262277.0,13,229092
2r4uhg,behindthegifs,802,A Proper Education,1420260251.0,32,229092
