id,subreddit,score,title,timeCreated,numComments,subscribers
4vcq99,gif,1322,Tiger goes for a check up,1469924454.0,38,168333
2rz7s8,gif,1325,Discovering bubbles ,1420940251.0,34,168333
17dno5,gif,1325,Fuck the gravity ,1359340959.0,36,168333
1kqc6l,gif,1319,Tom Brady likes what he sees X post from pics ,1377033520.0,34,168333
463kbp,gif,1323,Dad quietly out dances his two daughters,1455673053.0,46,168333
6tumu7,gif,1312,Chicken unintentionally decorates itself with bread,1502837938.0,34,168333
179j05,gif,1315,I believe you have my red stapler Brilliantly crafted gif,1359163714.0,22,168333
3i8bka,gif,1322, ,1440469114.0,25,168333
36r1cd,gif,1311,The Floor is Lava,1432242520.0,14,168333
2jfoqw,gif,1317,How I react when I downvote something I didn t mean to,1413509560.0,25,168333
4k3vfm,gif,1314,Camera stabilizing tech used in spoon for Parkinson s ,1463710709.0,38,168333
2g0997,gif,1317,Electric cycle news,1410387536.0,77,168333
2emaix,gif,1313,The ALS Ice Bucket Challenge done right ,1409082698.0,59,168333
836o6r,gif,1315,Handstand board flip,1520631030.0,18,168333
6y7jj5,gif,1317,13 policemen 6 horses and an infinite crowd,1504642057.0,26,168333
3j3cul,gif,1313,Stone Cutting Machine,1441062457.0,63,168333
58adp4,gif,1311,Hydraulic log splitter,1476914126.0,55,168333
38mjn6,gif,1314,Fluffy birds of prey ,1433507496.0,21,168333
5gd9r7,gif,1308,TRW I say we re going to the park,1480847331.0,24,168333
3uulzu,gif,1306,Michael Jordan s Iconic Free Throw Line Dunk,1448919296.0,48,168333
1jrjuh,gif,1304,DROP THE BASS ,1375764769.0,47,168333
3zeuf5,gif,1298,Tea time,1451944307.0,55,168333
6pp3re,gif,1296,Google Earth in VR,1501114461.0,50,168333
1d8ttx,gif,1296,A pot deal made right in front of a cop ,1367136787.0,29,168333
4efsu8,gif,1296,Day Night London,1460492085.0,28,168333
3bejfa,gif,1296,Shhh I m a tree ,1435530005.0,33,168333
3b2724,gif,1298,What I imagine a day as a Reddit mod is like,1435259046.0,37,168333
2bi2w7,gif,1301,Wind tunnel,1406157885.0,68,168333
6rytla,gif,1293,Girl sealing the entrance to the tomb ,1502060836.0,58,168333
21iuzq,gif,1289,Pride prank,1395972486.0,73,168333
7wltjj,gif,1293,Bear cub vs puma,1518302979.0,59,168333
7dbrsr,gif,1290,Who you gunna call Customer service ,1510860159.0,12,168333
4fqr4f,gif,1289,Playing ping pong with their heads,1461231691.0,41,168333
3ncgib,gif,1287,No jail can hold me dawg,1443911556.0,19,168333
4ncecn,gif,1284,First on a frozen lake,1465528441.0,50,168333
3n4gdw,gif,1287,MMA fight,1443748048.0,32,168333
1mdo2t,gif,1283,I did NOT Agree to NOM NOM NOM ,1379201464.0,4,168333
7havb6,gif,1287,Can t imagine how it must look like irl ,1512350421.0,35,168333
6uaazr,gif,1277,Fire Suppression Foam,1503008802.0,70,168333
6hmtoj,gif,1277,Dad builds a 3D printed prosthetic for his son and now builds them for other kids free of charge ,1497651766.0,19,168333
69bb2o,gif,1284,Netflix edited this out of the 90s Bill Nye Show,1493970980.0,329,168333
1b1fc0,gif,1279,Help ,1364332677.0,53,168333
1n0nt1,gif,1278,Bare to beardy,1380038177.0,35,168333
83l31v,gif,1271,and the moment President Trump accepted Rocketman s invite ,1520777713.0,16,168333
36hqjv,gif,1277,Snoring Dormouse ,1432072741.0,46,168333
1k9p9m,gif,1269,prison lighter,1376415926.0,27,168333
199gje,gif,1275,Angry Birds on ATM,1361921522.0,34,168333
7gfdmh,gif,1272,Best Buddies ,1512008443.0,30,168333
2z6cm9,gif,1272,When you take LSD but you still know ball is life,1426491883.0,29,168333
7zxax7,gif,1269,Oh Ichiro ,1519515547.0,54,168333
6p1mh9,gif,1270,Star Trails,1500849679.0,13,168333
4xd62u,gif,1274,Extinguishing a grease fire with water,1471032287.0,45,168333
3wizb4,gif,1268,Stonefish World s most venomous fish looks the part,1449965473.0,76,168333
2vyd4v,gif,1271,If RPG characters were honest,1424014222.0,28,168333
2cnyw0,gif,1269,This is what Master Chief looks like when he takes his helmet off at the end of Halo 1,1407248386.0,42,168333
7rksdl,gif,1262,Girl Sliding Down The Drain taken from r GirlsInaGif ,1516418636.0,56,168333
2minzk,gif,1266,the way of diving,1416217529.0,96,168333
7laftb,gif,1264,Kinetic Sculpture,1513901758.0,16,168333
34mwlq,gif,1259,The bro code ,1430614005.0,40,168333
7ycrj8,gif,1259,Playing in the snow,1518965771.0,8,168333
24ag7l,gif,1264,Giant Hand,1398819471.0,20,168333
1yk5ij,gif,1262,My new fear for Ukraine X Post from r pics ,1393039507.0,19,168333
3rmjvm,gif,1263,Jetmen flying wing to wing with an airbus,1446759024.0,95,168333
6yfvwh,gif,1258,A robot painting a mural on a chimney,1504736243.0,15,168333
4dgc2k,gif,1253,Twice girls sucking the soul out of the cameraman,1459890610.0,103,168333
3qjlx6,gif,1259,Sand in the Sahara,1446057986.0,53,168333
3ad4v4,gif,1258,Can you spot the drowning child ,1434713524.0,146,168333
37hbkv,gif,1252,In the office no one can hear you scream,1432775470.0,40,168333
4wq1bk,gif,1262,The parents of a Gymnastics Olympian barely keeping it together,1470690130.0,51,168333
7nmlvy,gif,1260,This is AWESOME,1514930929.0,25,168333
20zx88,gif,1252,Always a favorite,1395441220.0,43,168333
1k0uhh,gif,1257,Having fun in the 90 ,1376082607.0,51,168333
579dsk,gif,1254,Examining new generation with cassette player,1476379123.0,91,168333
3y6e6j,gif,1257,How an American open an envelope,1451074799.0,59,168333
2hgklr,gif,1255,This is deeply unsatisfying ,1411703253.0,51,168333
5u88ea,gif,1254,The floor is lava,1487203069.0,56,168333
5hwoyw,gif,1257,Drawing with glass pen,1481579497.0,23,168333
3s5nqt,gif,1250,Triple bird,1447119150.0,22,168333
3v7296,gif,1248,Harrison Ford Doesn t Get Emotional,1449120205.0,37,168333
3nplf0,gif,1245,Worth it dog,1444170550.0,23,168333
2ttsen,gif,1246,That s Close Enough Dog,1422381790.0,12,168333
1oujbo,gif,1250,Hedgeboat,1382322535.0,16,168333
1dwvwy,gif,1247,contemplate existence womp womp,1368015893.0,48,168333
1887qv,gif,1247,There should be a down vote gif of this,1360494138.0,82,168333
5phh49,gif,1246,Gibbon Running On A Rope Bridge,1485127629.0,28,168333
345h6p,gif,1239,Juggling with hands and feet,1430256909.0,35,168333
1i3v5v,gif,1241,If DBZ were real,1373604689.0,63,168333
3bak87,gif,1240,in a alternative universe,1435429589.0,25,168333
2kythz,gif,1237,How to make Cocaine,1414865723.0,158,168333
5z5f5t,gif,1240,Dog Fish,1489445801.0,31,168333
3z5qxx,gif,1243, Frozen pancakes,1451782905.0,46,168333
38deq9,gif,1238,Arguing on reddit,1433370061.0,43,168333
376p9b,gif,1242,trying to hydrate after a night of alcohol,1432574674.0,13,168333
197moz,gif,1240,Jennifer Lawrence is dorky and adorable,1361853231.0,61,168333
4z1qn8,gif,1239,Back To Work ,1471916490.0,45,168333
3hu4h6,gif,1238,Cuddle buddies,1440185072.0,23,168333
1z6hs0,gif,1233,For all the fucks you don t give,1393626308.0,38,168333
5d92cj,gif,1234,Should ve compensated,1479330268.0,39,168333
38xosk,gif,1234,Synchronized,1433732215.0,22,168333
5fpcm7,gif,1232,The Golden Dunes of Merzouga in Morocco,1480537949.0,28,168333
6gli6q,gif,1225,Soccer Football WWE ,1497218378.0,34,168333
4w2nyh,gif,1226,Classic Uncle Buck John Candy and Macaulay Culkin dialogue,1470311802.0,37,168333
3vxueg,gif,1235,That s some pretty impressive gymnastics,1449617863.0,39,168333
4gehff,gif,1229,Hotwheels,1461635281.0,31,168333
2zljov,gif,1225,First World Wizard Problems,1426810778.0,25,168333
6pez88,gif,1222,The chase,1501002550.0,4,168333
3n8c9o,gif,1227,So That Counts Right ,1443825787.0,55,168333
6xlqih,gif,1224,Let the hate flow through you ,1504385538.0,46,168333
2ztrn3,gif,1228,Man grabbing on a giant snake in the water,1426990759.0,83,168333
6p79wk,gif,1225,This is safe,1500916725.0,55,168333
1m0wum,gif,1222,Floor treadmill cheez it mouth guitar hero ,1378749407.0,39,168333
7xyi5o,gif,1224,She s got no fear while she s tearing up the streets,1518814157.0,147,168333
2qgzl2,gif,1220,How to segway ,1419654397.0,48,168333
149s7y,gif,1217,Human Evolution,1354672818.0,52,168333
29zzcc,gif,1221,Best dive I ve ever seen,1404714031.0,121,168333
3r6wn4,gif,1221,Hidden Beer Cooler,1446484065.0,46,168333
514dxs,gif,1213,Is that a little microphone I ve never seen one that small Cool kid,1473031016.0,30,168333
27gn9d,gif,1216,Crab getting sucked into a pipe ,1402083374.0,129,168333
2k3ss4,gif,1212,Bay of pigs,1414108716.0,35,168333
7y60yp,gif,1215,Levitating Moon lamp,1518893459.0,16,168333
3ke5vo,gif,1213,Simon says,1441918276.0,20,168333
3b6tx2,gif,1208,KO in slow motion ,1435352973.0,79,168333
3erpa2,gif,1215,A true master ,1438032602.0,8,168333
2cbde3,gif,1215,Dogbehave yourself,1406904335.0,21,168333
1d9xe0,gif,1215,Woah,1367192096.0,70,168333
6yniom,gif,1214,Mount Fuji 3 D book,1504823093.0,17,168333
58mlzy,gif,1208,Spider Man gets a new phone,1477076299.0,7,168333
2p6j0t,gif,1210,Stephen Colbert interviews Smaug,1418517108.0,40,168333
4kdbkv,gif,1211,Turbokiller Rescues His Girl,1463861701.0,54,168333
3k6zoq,gif,1209,The correct amount of timing and athleticism,1441801869.0,37,168333
2pq55u,gif,1206,Should have trained a bigger dog,1418969043.0,22,168333
39psoq,gif,1208,Till death do us part ,1434239973.0,8,168333
34vdut,gif,1201,When responding to text messages I just pick from my album of reaction gifs What should I add to it ,1430804657.0,54,168333
3fi6c5,gif,1210,Dad saves son from getting hit by a skateboard,1438548555.0,17,168333
3nu2ci,gif,1203,Sunbathing Seal,1444250898.0,28,168333
2phun0,gif,1207,I got it ,1418785737.0,24,168333
20mvrw,gif,1208,Oooh Earthquake ,1395099503.0,22,168333
1hmp1d,gif,1200,HEY Stop that now BOTH of you,1372969694.0,37,168333
586k8r,gif,1201,Patient cat getting his nails did,1476855611.0,63,168333
418z8f,gif,1203,How to get fired,1452989354.0,43,168333
7je5qw,gif,1197,Creepy Dolls Of The Future,1513143242.0,90,168333
3hmt8q,gif,1195,Guy tries to scare off charging moose After it charges a second time he uses his handgun to kill it Warning animal death ,1440046384.0,430,168333
2syoqr,gif,1193,Taste the rainbow ,1421723418.0,85,168333
23crm7,gif,1199,The Top 10 posts from the first week of r gifextra,1397856989.0,19,168333
5bm2av,gif,1197,When My Crush Replied me back ,1478553260.0,13,168333
1qdlye,gif,1196,This is how we fix problem in Russia ,1384209706.0,40,168333
6zgfuu,gif,1189,First world anarchist,1505175653.0,14,168333
3ujryd,gif,1190,Lightning Illuminate a Scary Skyline filled with Bats,1448714174.0,17,168333
2kd1dx,gif,1194,Run to the hills Run for your lives ,1414350552.0,21,168333
3xp5on,gif,1189,Edible Snow Globes ,1450731444.0,43,168333
387nvn,gif,1186,Can you fucking knot ,1433278998.0,31,168333
3sovnz,gif,1181,Header,1447468441.0,21,168333
2l2e4b,gif,1184,Beautiful Snow Art,1414968285.0,27,168333
4by0wb,gif,1181,His girlfriend must be a bitch ,1458963503.0,96,168333
1zj2am,gif,1181,What I expect on my cake day,1393971042.0,31,168333
1z4o2d,gif,1182,the oldest gif i know of ,1393571369.0,52,168333
71ijci,gif,1179,Exploding Wine Barrel,1506022811.0,80,168333
35hq97,gif,1182,repost ,1431296071.0,42,168333
1k35d7,gif,1179,Dolphin Collision x post r naturegifs ,1376168829.0,38,168333
40g32w,gif,1178,Time may change me,1452533696.0,34,168333
1una3y,gif,1175,I love her I m obsessed with her Oh my god she is so fine ,1389152632.0,37,168333
3oo9t3,gif,1183,See what I just did there Acting ,1444820498.0,11,168333
1j3mbq,gif,1177,Women gets hit by car,1374880037.0,29,168333
1awql1,gif,1179,OHMYGAWWWDABAAAAALLL,1364152387.0,13,168333
23vqlc,gif,1176,Tennis court in Dubai,1398393213.0,111,168333
1aus0x,gif,1173,The handbook,1364068012.0,12,168333
2zbjj5,gif,1179,This is pretty awesome,1426597634.0,31,168333
59u534,gif,1170,Timelapse,1477686686.0,82,168333
2axgkr,gif,1168,Nerves of Steel,1405602421.0,28,168333
6uq445,gif,1172,I don t know what s going on but there it is ,1503190135.0,48,168333
2mwlne,gif,1170,Nipping toughened glass drop 100000 FPS camera ,1416541444.0,23,168333
2ik801,gif,1173,Gotta Go Fast,1412720357.0,15,168333
23l23h,gif,1172,Fat man on a blow up water slide ,1398111412.0,46,168333
7tla8r,gif,1165,Octopus traveling and hiding,1517186617.0,14,168333
54g77m,gif,1174,Having a bit of fun with the mascot,1474854474.0,7,168333
3kbpy8,gif,1167,Dude steals a shoe while skydiving,1441874254.0,71,168333
3dqou9,gif,1174,The Victory dance at the end,1437260599.0,45,168333
3126mk,gif,1173,Hunter throws his bow at a pheasant when it runs away with an arrow stuck in it,1427927509.0,80,168333
2arex3,gif,1164,German players present the World Cup to their Fans in Berlin,1405460389.0,73,168333
1bopkj,gif,1169,Cat teaching dog a trick,1365137155.0,14,168333
6r4759,gif,1168,Shrubbery,1501709771.0,26,168333
35ls2l,gif,1169,This is a hornet cat A harmless cat which happens to do an excellent job of looking like a hornet ,1431387133.0,23,168333
1v8j2k,gif,1169,Awesome pass,1389775737.0,30,168333
7fn4c7,gif,1165,Etched Pokeballs,1511734576.0,22,168333
7shch9,gif,1159,Serengeti sights,1516767424.0,31,168333
76rl2w,gif,1165,Drone driving skills,1508199625.0,38,168333
4w4jl5,gif,1165,Almost got killed by a Chinese driver today ,1470346804.0,56,168333
3ouv97,gif,1155,My daily fucking life Nowadays am hating it ,1444945990.0,106,168333
1r4xhu,gif,1157,SHIT,1385068608.0,29,168333
1ib219,gif,1155,This is how I feel as a 34 y o male who s been working out for 2 months and never had my abdominal muscles show until now ,1373876751.0,39,168333
1d3bme,gif,1162,This actually would take a lot of skill,1366936929.0,46,168333
2j7t8f,gif,1155,grandma I m full,1413324220.0,49,168333
6rkov9,gif,1157,Mirror Art,1501884482.0,9,168333
55zbm8,gif,1153,2 girls 1 rope,1475701042.0,45,168333
3zb7ve,gif,1160,A quick impression of juggling on a motorcycle ,1451880280.0,22,168333
2vjala,gif,1158,Helicopter precision,1423692139.0,31,168333
1fkphl,gif,1154,This is Passau Germany right now,1370287268.0,62,168333
3aya2p,gif,1156,Cat scares Bear,1435182811.0,25,168333
2vfafd,gif,1151,GTA Los Angeles,1423611170.0,102,168333
2uryfw,gif,1149,Hey NO this is MINE ,1423101424.0,57,168333
5rtsox,gif,1152,The best dabb you ve seen all minute ,1486155789.0,12,168333
1fm58s,gif,1148,Last Night s Game of Thrones a gif ,1370330377.0,72,168333
39kwle,gif,1151,Woman judo throws a man harassing her,1434143576.0,47,168333
1hssmv,gif,1147,Want some ice cream ,1373229363.0,29,168333
3feqdu,gif,1144,When I convince a friend to create an account,1438467857.0,48,168333
12m0jv,gif,1144,My GF just called with a 25min problem,1352065931.0,18,168333
2atif0,gif,1143,This hits close ,1405503820.0,32,168333
2818k1,gif,1140,MRW I was walking to my boss office to talk about a possible raise when I saw a coworker walk out crying because she was fired,1402671702.0,13,168333
2kvkc8,gif,1144,Screw traffic signals ,1414785443.0,71,168333
2jvskw,gif,1146,Laziness on Sunday afternoon,1413923977.0,11,168333
2ueeyk,gif,1139,Miss Amazonas the amazonas soul is strong on this one ,1422819899.0,70,168333
16znhk,gif,1144,Open ,1358808889.0,50,168333
73m3y6,gif,1139,Spend tons of money on toys and his favorite is a ball bearing and a clothes hamper ,1506899122.0,26,168333
44p3e3,gif,1142,When your older brother overshadows you and your accomplishments,1454930761.0,61,168333
4atr0w,gif,1134,Bouncing over a wall,1458259141.0,19,168333
1j0q3c,gif,1134,Cheetah shivering in the rain Strangely beautiful strangely sad ,1374777352.0,55,168333
2riozs,gif,1135,When in doubt clear cache and cookies OC ,1420585768.0,26,168333
4q2x7t,gif,1131,If at first you don t succeed,1467056809.0,31,168333
3im10o,gif,1133,Kids trying dark chocolate for the first time,1440719741.0,81,168333
3wykay,gif,1134,Real firing Star Wars blaster,1450227594.0,54,168333
6d1ju9,gif,1135,Exorcist Demon Spider,1495654356.0,43,168333
3dtpid,gif,1130,Hoop bird,1437331508.0,27,168333
3d0zcl,gif,1129,22000 miles up a Japanese Satellite is taking an image every 10 minutes,1436748485.0,40,168333
7hqbig,gif,1129,This girl s eye of the tiger don t quit ,1512516043.0,65,168333
5kjytw,gif,1130,Helping a sloth cross the road,1482877871.0,66,168333
1uppxu,gif,1129,What people in Chicago really need,1389223071.0,33,168333
38wrq9,gif,1124,Rubbish tossed from car ,1433715766.0,36,168333
3ko799,gif,1131,The state of a foot peg after a lowside crash of a MotoGP bike,1442100526.0,26,168333
21qxpr,gif,1126,Human what is dis ,1396219072.0,17,168333
1z9tqv,gif,1128,So most of my friends coming to my birthday outing canceled on me last minute almost simultaneously ,1393719774.0,113,168333
1hh2rx,gif,1126,My cat found the bag of catnip I got him and tore it to shreds I caught him doing this afterwards ,1372764796.0,14,168333
5quyby,gif,1122,World s Okayest Cat,1485740538.0,8,168333
25oh9i,gif,1128,True,1400235128.0,15,168333
69h8i3,gif,1121,Who did this,1494045978.0,43,168333
4c18ys,gif,1125,Wheel art,1459029635.0,50,168333
1fqmvt,gif,1123,Gotcha ,1370488340.0,19,168333
4uog0t,gif,1120,Bow fisherman gets two fish with one arrow,1469566189.0,32,168333
5vbbi6,gif,1114,Don t mind me just passing through,1487710486.0,24,168333
36zhbv,gif,1118,The Floor is Lava Ultimate Edition,1432415507.0,30,168333
3a1kvn,gif,1114,The Super Strong Meter Maid,1434494878.0,52,168333
7kwqfn,gif,1118,Making of Akita dog candy,1513750498.0,27,168333
2rdays,gif,1113,Nice kick,1420460766.0,63,168333
2ll7vo,gif,1110,Swedish TV interview about a road curve death trap guess what happens next,1415405515.0,37,168333
3cm2qw,gif,1111,14th Century turnt af,1436427435.0,34,168333
3e713i,gif,1113,Puppy slide,1437599947.0,10,168333
74gmmh,gif,1114,Break on through to the other side,1507245539.0,16,168333
73bnmp,gif,1114,Who am i ,1506757329.0,48,168333
415k9b,gif,1113,Wanna play fetch ,1452927028.0,9,168333
2sjy1a,gif,1116,You re going to need a bigger boat,1421383718.0,45,168333
54x0vz,gif,1113,Cone Jellyfish eats another cone jellyfish ,1475106955.0,71,168333
4je79g,gif,1107,Huskicle,1463306819.0,19,168333
1kbw5t,gif,1112,Sup,1376484834.0,33,168333
7tcuoa,gif,1109,This man has been waiting his entire life for this ,1517090570.0,39,168333
4zujfy,gif,1113,Balls very long gif ,1472338475.0,52,168333
4lfibg,gif,1106,Ferris Wheel Light Show,1464464773.0,14,168333
31j7jz,gif,1112,Easter bunny takes out 4 racing presidents ,1428281315.0,26,168333
6w3z4g,gif,1112,Weekend Plan,1503755124.0,20,168333
4onws4,gif,1108,They just don t give a fu k in Eastern Europe,1466271994.0,67,168333
49ch9o,gif,1107,Raft With A Roll Cage,1457384084.0,17,168333
7oc62q,gif,1109,Glacier Gliding With Led Lighting this looks dangerous ,1515197448.0,19,168333
7xa4zy,gif,1111,Squirrel vs Lamborghini,1518564595.0,24,168333
1dezjg,gif,1110,Follow your dreams ,1367365236.0,10,168333
46ezs5,gif,1104,Just a couple of lounging lizards,1455834869.0,21,168333
1txx8y,gif,1105,He looks so happy,1388355651.0,34,168333
4kp9ok,gif,1101,Young fan makes a great catch,1464055437.0,35,168333
2hs66p,gif,1108,Poker Faces ,1412022271.0,9,168333
25f01h,gif,1097,She s got the moves,1399977287.0,87,168333
1x7cdz,gif,1099,I ll shovel the snow x post from r AnimalsBeingBros ,1391743740.0,20,168333
6sew5t,gif,1101,When the crew is having a productive day but an angry OSHA inspector turns up,1502240786.0,37,168333
2jonlk,gif,1099,My sisters cat isn t too smart,1413747169.0,23,168333
32u4sv,gif,1094,Red Hot Nickel Ball Vs Jawbreaker GIF on Imgur,1429239498.0,52,168333
4fh7ct,gif,1102,This a warning Steve Next time I ll hold till the end ,1461095573.0,17,168333
1h4rjz,gif,1099,Cat bed ,1372307496.0,11,168333
4y0dl4,gif,1093,Lego shadows,1471393675.0,10,168333
15qdw5,gif,1093,How to hula hoop bad video angle sorry ,1357005787.0,49,168333
1l7752,gif,1093,daaaaamn thats kinda funny P,1377653293.0,47,168333
7igjic,gif,1091,Put that phone away ,1512783477.0,106,168333
24ysi5,gif,1093,Krillin s signature move ,1399511784.0,56,168333
1i5gus,gif,1094,Mini PC awesome ,1373664889.0,61,168333
3gl2aq,gif,1094,Seems Legit,1439324535.0,10,168333
5gfvvz,gif,1090,Turning off God mode,1480894075.0,28,168333
372we9,gif,1084,I cant stop once i ve started ,1432492715.0,24,168333
54twit,gif,1089,Transforming furniture,1475053470.0,35,168333
7x0wc7,gif,1083,Sand viper blending in,1518472853.0,34,168333
3ogpeu,gif,1088,It s a hard life being The Great Khali,1444693812.0,19,168333
2j4w9w,gif,1087,The defendant s lawyer s demeanor is what really makes this gif He s gone past flinching at comedy maybe an old one re posted but what isn t these days ,1413252263.0,25,168333
1ks2dg,gif,1083,How I feel after having a bad day and my boyfriend wants sex ,1377082186.0,44,168333
48mcg2,gif,1080,This little rectangle is VERY excited to meet the cat,1456957752.0,50,168333
45enw3,gif,1079,You can t fix stupid,1455311772.0,42,168333
42xftr,gif,1084,What some dads do with their snowboards,1453929898.0,13,168333
1f746t,gif,1089,Huh what just happened ,1369776191.0,18,168333
63zxsh,gif,1086,Can t Hardly Wait to hit the front page ,1491595225.0,29,168333
539x19,gif,1085,Putin approves,1474186748.0,23,168333
1smkac,gif,1084,Wat,1386787158.0,42,168333
697bis,gif,1080,Pet of the day,1493931302.0,23,168333
7ydzyy,gif,1000,Super Dad to the rescue,1518986434.0,28,168333
7pxhqj,Cinemagraphs,35706,Santa Monica Pier,1515801623.0,316,316622
71a76f,Cinemagraphs,27881,A very GIFted artist,1505932772.0,476,316622
83qcfv,Cinemagraphs,18563,The legend Luke Skywalker,1520837563.0,874,316622
6pxbaa,Cinemagraphs,18510,Say When,1501203668.0,246,316622
6sms9g,Cinemagraphs,17559,When Front Page GIFs Deserve to be Cinemagraphs,1502326334.0,152,316622
6n8mvx,Cinemagraphs,16501,Summer Heat,1500063169.0,359,316622
7gd7xh,Cinemagraphs,13530,Alone in Kyoto Lost in Translation 2003 ,1511990700.0,198,316622
6axj33,Cinemagraphs,13126,Card games in Havasu Creek AZ ,1494706583.0,212,316622
7ur1f9,Cinemagraphs,12994,Piper the Aviation Bird Dog,1517604189.0,109,316622
6d7cbz,Cinemagraphs,12769,Saved this two years ago before I even knew the term Source unknown ,1495714232.0,97,316622
6m1o5n,Cinemagraphs,12204,Above the mountains in New Zealand ,1499557767.0,48,316622
7d4xlc,Cinemagraphs,12104,My latest cinemagraph,1510789595.0,110,316622
7wspsl,Cinemagraphs,12046,MotoGP Slow Mo ,1518383668.0,151,316622
78187j,Cinemagraphs,11771,Cameraman sets up in Tropical Storm Fung wong Taiwan ,1508718854.0,86,316622
7qjjui,Cinemagraphs,11606,Summer rain in Okusawa Tokyo ,1516050386.0,72,316622
76427r,Cinemagraphs,11491,Rainy night in Montreal ,1507921478.0,156,316622
68fitw,Cinemagraphs,10669,Brooklyn,1493588808.0,232,316622
7m7p5c,Cinemagraphs,10558,Blade Runner 2049 Catching snowflakes,1514322818.0,215,316622
6wcfjj,Cinemagraphs,10493,Snow falls on Hyannis Harbour Massachusetts ,1503872815.0,90,316622
72c5ly,Cinemagraphs,10219,Hawaiian parking hazard ,1506372069.0,149,316622
6wx5qc,Cinemagraphs,10026,A Beautiful Wave by Ray Collins,1504100620.0,113,316622
6o06fc,Cinemagraphs,9772,A pool in Patagonia,1500406370.0,74,316622
79tcwi,Cinemagraphs,9590,Stranger Things,1509451477.0,113,316622
77i7ir,Cinemagraphs,9494,Summer Breeze,1508483928.0,117,316622
7cg89w,Cinemagraphs,9217,Snowy day in Laramie Wyoming ,1510531999.0,158,316622
7zhma4,Cinemagraphs,9176,Old Friends ,1519356775.0,36,316622
5wwji6,Cinemagraphs,8891,Lost in thought OC ,1488410856.0,84,316622
6vrc2x,Cinemagraphs,8828,The Grand Budapest Hotel Agatha and the Carousel,1503614993.0,129,316622
5fqwe7,Cinemagraphs,8747,Half in half out ,1480556037.0,84,316622
6ef5ss,Cinemagraphs,8726,Fargo,1496268325.0,128,316622
5t0ix8,Cinemagraphs,8696,Winter Train Journey ,1486682172.0,58,316622
5hkpg6,Cinemagraphs,8416,Snow Game x post from r GreenBayPackers ,1481413916.0,106,316622
6yvpy1,Cinemagraphs,8399,Ain t nobody praying for me ,1504915646.0,105,316622
7im8d7,Cinemagraphs,8370,Dunkirk Tom Hardy stand in front of a burning plane,1512846904.0,176,316622
7hvl4e,Cinemagraphs,8262,Waiter there s a tsunami in my knife ,1512562516.0,60,316622
71yxfn,Cinemagraphs,8086,Come fly with me ,1506209660.0,90,316622
7kea3c,Cinemagraphs,8045,Filming tropical storm Fung Wong in Taiwan ,1513552715.0,61,316622
6913ti,Cinemagraphs,8050,Firenado for science ,1493854858.0,63,316622
6x3lkc,Cinemagraphs,7653,Incoming wave,1504169316.0,76,316622
661wgw,Cinemagraphs,7635,Cherry Blossom,1492538540.0,77,316622
7s65uf,Cinemagraphs,7633,Crops by firelight,1516660947.0,114,316622
6xan33,Cinemagraphs,7591,They won t take me out my element ,1504250474.0,124,316622
708rjo,Cinemagraphs,7430,Lucifer arrives for John s soul Constantine 2005 ,1505496669.0,247,316622
7i7d4v,Cinemagraphs,7436,This is how a pilot is born,1512691031.0,45,316622
6gm4ln,Cinemagraphs,7271,Lava flow at the Kilauea Volcano Hawaii ,1497225830.0,53,316622
6xspd8,Cinemagraphs,7234,Morning on the Thames ,1504467977.0,48,316622
77qg9a,Cinemagraphs,7004,Steam and sparks at Beitai Steel Works China ,1508576669.0,58,316622
7qvhxu,Cinemagraphs,6986,Fellow user u EsspressoMstr asked for this so here it is ,1516165120.0,34,316622
7ifkfx,Cinemagraphs,6958,A moment in the snow requested ,1512774894.0,62,316622
75g431,Cinemagraphs,6825,The Goblin King Labyrinth 1986 ,1507659632.0,121,316622
7c0owz,Cinemagraphs,6814,Camping alone in the Finnish countryside ,1510344274.0,152,316622
7y6egd,Cinemagraphs,6710,Strange things are afoot at the Circle K Bill and Ted s Bogus Journey 1991 ,1518899593.0,83,316622
78vcbc,Cinemagraphs,6582,Peace in the Jiuzhaigou Valley China,1509051236.0,24,316622
5yo1qq,Cinemagraphs,6500,I Feel It Coming,1489202095.0,117,316622
6ad7ld,Cinemagraphs,6367,Twelve Angry Men,1494456441.0,136,316622
7blfap,Cinemagraphs,6242,Sole Soothing ,1510177971.0,57,316622
7w7zdu,Cinemagraphs,6219,Celebrating the beginning of the Olympic Winter games with a grandiose firework ,1518151569.0,55,316622
5vxsfa,Cinemagraphs,6222,Darth Vader in a dark hallway,1487976121.0,170,316622
78haxb,Cinemagraphs,6094,Seaside,1508894888.0,45,316622
